Data,Acompanhamentos,Prato Principal,Guarnição,Salada,Sobremesa,Refresco,Extra,Nota Técnica
2017-08-22,ARROZ E FEIJÃO,Peixe frito,Chuhu refogado,Alface,Gelatina,Cajú,PÃO E CAFÉ,Contém glúten no pão.
2017-08-23,ARROZ E FEIJÃO,Carne em cubos com batata,------,Acelga com beterraba,Iogurte,Limão,PÃO E CAFÉ,Contém glúten no pão.
2017-08-24,ARROZ E FEIJÃO,Feijoada,farofa,Cenoura com rabanete,Laranja pera,Abacaxí,PÃO E CAFÉ,Contém glúten no pão. Não contém ovos e lactose.
2017-08-25,ARROZ E FEIJÃO,Frango ao molho,Couve refogada,Tomate com cebola,Maçã,Uva,PÃO E CAFÉ,Contém glúten no pão. Não contém lactose e ovos.
2017-08-28,ARROZ E FEIJÃO,Strogonoff de carne,Batata palha,Alface com tomate e azeitona preta,Maria mole com chocolate,Maracujá,PÃO E CAFÉ,Contém glúten no pão e no strogonoff de carne. Contém lactose no strogonoff de carne e na maria mole. Não contém ovos.
2017-08-29,ARROZ E FEIJÃO,Frango assado ao molho de maracujá,"Macarrão à primavera (ervilha, milho, tomate e azeitona verde)","Acelga com repolho, cenoura e croutons",Doce de leite,Larnaja,PÃO E CAFÉ,Contém glúten no pão e no macarrão à primavera. Contém lactose no frango ao molho de maracujá e no doce de leite. Contém ovos no macarrão à primavera.
2017-08-30,ARROZ E FEIJÃO,Bife ao molho de queijo e bacon,Nhoque ao sugo,Legumes misto,Barra de cereal,Manga,PÃO E CAFÉ,"Contém glúten no pão, no nhoque ao sugo e na barra de cereal. Contém lactose no bife ao molho e na barra de cereal. Não contém ovos."
2017-08-31,ARROZ E FEIJÃO,Isca de frango ao molho branco,Batata refogada,Alface,Brigadeiro cremoso,Cajú,PÃO E CAFÉ,Contém glúten no pão e na isca de frango ao molho. Contém lactose na isca de frango ao molho e no brigadeiro cremoso. Não contém ovos.
2017-09-01,ARROZ E FEIJÃO,"Pernil desfiado com tomate, cebola, cenoura, milho e ervilha",Farofa com ovos e azeitonas,Beterraba ralada,Tangerina murcott,Uva,PÃO E CAFÉ,Contém glúten no pão. Não contém lactose. Contém ovos na farofa.
2017-09-04,ARROZ E FEIJÃO,Carne picada com brócolis,------,Alface,Banana nanica,Maracujá,PÃO E CAFÉ,Contém glúten no pão. Não contém ovos e lactose.
2017-09-05,ARROZ E FEIJÃO,Bife ao molho primavera,------,Berinjela à escabeche,Maçã,Tangerina,PÃO E CAFÉ,Contém glúten no pão.
2017-09-06,ARROZ E FEIJÃO,Frango assado,Macarrão ao sugo,Almeirão,Laranja,Caju,PÃO E CAFÉ,Contém glúten no pão e no macarrão ao sugo. Não contém lactose. Contém ovos no macarrão ao sugo.
2017-09-11,ARROZ E FEIJÃO,Nuggets assado,Creme de milho,Acelga com pepino,Maçã,Manga,PÃO E CAFÉ,"Contém glúten no pão,no nuggets assado e no creme de milho. Contém lactose no nuggets assado e no creme de milho. Não contém ovos."
2017-09-12,ARROZ E FEIJÃO,Isca de carne com mandioquinha,------,Pepino com maçã,Gelatina,Laranja,PÃO E CAFÉ,Contém glúten no pão.
2017-09-13,ARROZ E FEIJÃO,Frango assado,Chuchu refogado,Alface e agrião,Iogurte,Limão,PÃO E CAFÉ,Contém glúten no pão. Contém lactose no iogurte. Não contém ovos.
2017-09-14,ARROZ E FEIJÃO,Linguiça toscana assada,"Macarrão à primavera (ervilha, milho, tomate e azeitona preta)",Rúcula,Cocada branca,Maracujá,PÃO E CAFÉ,Contém glúten no pão e no macarrão à primavera. Contém ovos no macarrão ao sugo. Contém leite na cocada branca.
2017-09-15,ARROZ E FEIJÃO,Almondegas ao sugo,Purê de batata,Acelga,Laranja,Caju,PÃO E CAFÉ,Contém glúten no pão.
2017-09-18,ARROZ E FEIJÃO,Paleta suína com mandioca,------,Couve com laranja,Maçã,Limão,PÃO E CAFÉ,Contém glúten no pão.
2017-09-19,ARROZ E FEIJÃO,Frango assado,------,Alface com beterraba,Barra de cereal,Laranja,PÃO E CAFÉ,Contém glúten na barra de cereal e no pão. Contém lactose na barra de cereal. Não contém ovos.
2017-09-20,ARROZ E FEIJÃO,Isca de carne à chinesa,------,Almeirão com rabanete,Banana,Uva,PÃO E CAFÉ,Contém glúten no pão.
2017-09-21,ARROZ E FEIJÃO,Bife à pizzaiolo,Escarola refogada,Chuchu ao vinagrete,Doce de leite,Manga,PÃO E CAFÉ,Contém glúten no pão. Contém lactose no bife à pizzaiolo e no doce de leite. Não contém ovos.
2017-09-22,ARROZ E FEIJÃO,Carne assada ao molho shoyo,"Farofa com ovos, milho, ervilha e azeitona",Repolho bicolor,Laranja,Limão,PÃO E CAFÉ,Contém glúten no pão. Não contém lactose. Contém ovos na farofa.
2017-09-25,ARROZ E FEIJÃO,Strogonoff de frango,Batata refogada,Alface com laranja,Maçã,Laranja,PÃO E CAFÉ,Contém glúten no pão. Contém lactose no strogonoff de frango. Não contém ovos.
2017-09-26,ARROZ E FEIJÃO,Carne picada com legumes,------,Acelga,Iogurte,Maracujá,PÃO E CAFÉ,Contém glúten no pão.
2017-09-27,ARROZ E FEIJÃO,Salsicha ao sugo,Batata refogada,Alface com abobrinha e vinagrete,Banana,Tangerina,PÃO E CAFÉ,Contém glúten no pão.
2017-09-28,ARROZ E FEIJÃO,Ovo cozido,Escarola refogada,Soja com vinagrete,Goiabada,Caju,PÃO E CAFÉ,Contém glúten no pão.
2017-09-29,ARROZ E FEIJÃO,Carne em cubos com batata,Couve refogada,Repolho bicolor,Laranja,Uva,PÃO E CAFÉ,Contém glúten no pão. Não contém ovos e lactose.
2017-10-02,ARROZ E FEIJÃO,Frango assado,Macarrão ao sugo,Alface com rabanete,Maçã,Abacaxí,PÃO E CAFÉ,Contém glúten no pão e no macarrão. Contém ovos no macarrão. Não contém lactose.
2017-10-03,ARROZ E FEIJÃO,BIFE À PIZZAIOLO,-,BETERRABA RALADA,DOCE DE LEITE,MANGA,PÃO E CAFÉ,Contém glúten no pão. Contém lactose no bife à pizzaiolo e no doce de leite. Não contém ovos.
2017-10-04,ARROZ E FEIJÃO,LINGUIÇA TOSCANA ASSADA,POLENTA AO SUGO,COUVE,BANANA,LARANJA,PÃO E CAFÉ,Contém glúten no pão.
2017-10-05,ARROZ E FEIJÃO,ISCA DE CARNE COM BATATA,-,PEPINO,ARROZ DOCE,CAJU,PÃO E CAFÉ,Contém glúten no pão.
2017-10-06,ARROZ E FEIJÃO,COPA LOMBO ASSADO AO MOLHO SHOYO,FAROFA COM CENOURA E BACON,ACELGA COM VINAGRETE,LARANJA PERA,LIMÃO,PÃO E CAFÉ,Contém glúten no pão. Não contém ovos e lactose.
2017-10-09,ARROZ E FEIJÃO,CARNE PICADA COM MANDIOQUINHA,-,REPOLHO BICOLOR,MAÇÃ,TANGERINA,PÃO E CAFÉ,Contém glúten no pão. Não contém ovos e lactose.
2017-10-10,ARROZ E FEIJÃO,FRANGO CREMOSO COM MILHO,BATATA REFOGADA,ALFACE LISA COM RABANETE,LARANJA,UVA,PÃO E CAFÉ,Contém glúten no pão e no frango cremoso com milho. Contém lactose no frango cremoso com milho. Não contém ovos.
2017-10-11,ARROZ E FEIJÃO,CARNE EM CUBOS COM BATATA,---,ESCAROLA,IOGURTE SABOR MORANGO,ABACAXI,PÃO E CAFÉ,Contém glúten no pão. Contém lactose no iogurte sabor morango.
2017-10-16,ARROZ E FEIJÃO,ALMÔNDEGAS AO MOLHO SUGO,CENOURA REFOGADA,ALFACE COM BETERRABA,LARANJA,MARACUJÁ,PÃO E CAFÉ,
2017-10-17,ARROZ E FEIJÃO,FRANGO ASSADO,QUIBEBE,ESCAROLA,IOGURTE SABOR MORANGO,ABACAXI,PÃO E CAFÉ,Contém glúten no pão. Contém lactose no iogurte. Não contém ovos.
2017-10-18,ARROZ E FEIJÃO,STROGONOFF DE CARNE,BATATA REFOGADA,ALMEIRÃO,BANANA NANICA,MANGA,PÃO E CAFÉ,Contém glúten no pão e no strogonoff de carne. Contém lactose no strogonoff de carne. Não contém ovos.
2017-10-19,ARROZ E FEIJÃO,PEIXE FRITO,CHUCHU REFOGADO,ALFACE,MAÇÃ,LARANJA,PÃO E CAFÉ,Contém glúten no pão e no peixe frito. Não contém ovos e lactose.
2017-10-20,ARROZ E FEIJÃO,LAGARTO ASSADO AO MOLHO SHOYO,"FAROFA COM CARNE, OVOS BACOM E CENOURA",ACELGA COM AGRIÃO/TABULE,GOIABADA,CAJU,PÃO E CAFÉ,Contém glúten no pão e no tabule. Contém ovos e lactose na farofa.
2017-10-23,ARROZ E FEIJÃO,STEAK ASSADO,CREME DE MILHO,ALMEIRÃO,MAÇÃ,LIMÃO,PÃO E CAFÉ,Contém glúten no pão e no steak assado. Contém lactose no steak assado. Não contém ovos.
2017-10-24,ARROZ E FEIJÃO,CARNE EM CUBOS COM MANDIOCA,-,ESCAROLA,LARANJA,UVA,PÃO E CAFÉ,Contém glúten no pão. Não contém lactose e ovos.
2017-10-25,ARROZ E FEIJÃO,"ISCA DE FRANGO COM TOMATE, AZEITONA, MILHO E ERVILHA",ABOBRINHA REFOGADA,SALADA VERDE,GELATINA DE ABACAXÍ,UVA,PÃO E CAFÉ,Contém glúten no pão. Contém lactose na isca de frango. Não contém ovos.
2017-10-26,ARROZ E FEIJÃO,BIFE ACEBOLADO,-,MAIONESE/COUVE,BANANA,ABACAXI,PÃO E CAFÉ,Contém glúten no pão.
2017-10-27,ARROZ E FEIJÃO,PEIXE FRITO,ABOBRINHA REFOGADA,ALFACE,IOGURTE,LIMÃO,PÃO E CAFÉ,Contém glúten no pão. Contém lactose no iogurte. Não contém ovos.
2017-10-30,ARROZ E FEIJÃO,BIFE À PARMEGGIANA,ESCAROLA REFOGADA,PEPINO,MAÇÃ,LARANJA,PÃO E CAFÉ,"Contém glúten no pão, e no bife a parmegiana. Contém lactose e ovos no bife a parmegiana."
2017-10-31,ARROZ E FEIJÃO,FRANGO ASSADO,-,MISTA COM SOJA,LARANJA,CAJU,PÃO E CAFÉ,Contém glúten no pão. Não contém ovos e lactose.
2017-11-06,ARROZ E FEIJÃO,Steak assado,Creme de milho,Almeirão,Maçã,Abacaxí,PÃO E CAFÉ,Contém glúten no pão e no steak assado. Contém lactose no steak assado e no creme de milho. Não contém ovos.
2017-11-07,ARROZ E FEIJÃO,Frango assado,Purê de batata,Alface,Banana nanica,Uva,PÃO E CAFÉ,Contém glúten no pão. Contém lactose no purê de batata. Não contém ovos.
2017-11-08,ARROZ E FEIJÃO,Bife ao vinagrete quente,-----,Repolho bicolor,Gelatina de morango,Suco de caju,PÃO E CAFÉ,Contém glúten no pão. Não contém lactose e ovos.
2017-11-09,ARROZ E FEIJÃO,Isca de carne à chinesa,------,Escarola,Laranja pera,Maracujá,PÃO E CAFÉ,Contém glúten no pão. Não contém ovos e lactose.
2017-11-10,ARROZ E FEIJÃO,Carne assada ao molho shoyo,"Farofa com cenoura, carne e ovos",Alface lisa,Goiabada,Limão,PÃO E CAFÉ,"Contém glúten no pão. Contém ovos na farofa com cenoura, carne e ovos. Não contém lactose."
2017-11-13,ARROZ E FEIJÃO,Bife ao molho de milho,------,Escarola,Maçã,Tangerina,PÃO E CAFÉ,Contém glúten no pão. Não contém ovos e lactose.
2017-11-14,ARROZ E FEIJÃO,Frango assado,------,Acelga,Maçã,Laranja,PÃO E CAFÉ,Contém glúten no pão. Não contém lactose e ovos.
2017-11-16,ARROZ E FEIJÃO,Quibe assado,Creme de espinafre,Alface lisa,Maçã,Manga,PÃO E CAFÉ,Contém glúten no pão e no quibe. Contém lactose no creme de espinafre.
2017-11-17,ARROZ E FEIJÃO,Strogonoff de carne,Batata refogada,Beterraba ralada/ repolho,Laranja,Abacaxi,PÃO E CAFÉ,Contém glúten no pão. Contém lactose no strogonoff.
2017-11-21,ARROZ E FEIJÃO,Almondega assada,MACARRÃO AO SUGO,COUVE,BANANA,Uva,PÃO E CAFÉ,"Contém glúten no pão, almondegas e macarrão. Contém ovos no macarrão."
2017-11-22,ARROZ E FEIJÃO,"Bife com palmito, milho, ervilha e tomate",------,Berinjela à escabeche,Gelatina de morango,Caju,PÃO E CAFÉ,Contém glúten no pão. Não contém ovos e lactose.
2017-11-23,ARROZ E FEIJÃO,Carne em cubos com batata,------,Acelga com agrião,ARROZ DOCE,Maracujá,PÃO E CAFÉ,Contém glúten no pão. Contém lactose no arroz doce.
2017-11-24,ARROZ E FEIJÃO,Carne desfiadac/milho/ervilha/tomate/azeitona,------,Tomate,MAÇÃ,Limão,PÃO E CAFÉ,Contém glúten no pão. Não contém lactose e ovos.
2017-11-27,ARROZ E FEIJÃO,Bife ao molho de tomate,Chuchu refogado,Escarola,Banana nanica,Tangerina,PÃO E CAFÉ,Contém glúten no pão. Não contém lactose.
2017-11-28,ARROZ E FEIJÃO,Frango assado,Abobrinha refogada,Alface com pepino,Laranja,Laranja,PÃO E CAFÉ,Contém glúten no pão. Não contém ovos e lactose.
2017-11-29,ARROZ E FEIJÃO,Linguiça toscana ao vinagrete,Polenta cremosa,Couve,Maçã,Manga,PÃO E CAFÉ,Contém glúten no pão.
2017-11-30,ARROZ E FEIJÃO,Carne em cubos com mandioquinha,--,Rúcula,Pudim caramelo,Abacaxi,PÃO E CAFÉ,Contém glúten no pão. Não contém ovos e lactose.
2017-12-01,ARROZ E FEIJÃO,Isca de frango com legumes,--,Acelga com repolho roxo,Gelatina de abacaxi,Laranja,PÃO E CAFÉ,Contém glúten no pão. Não contém lactose.
2017-12-04,ARROZ E FEIJÃO,Salsicha ao molho,Macarrão à primavera,Couve,Maçã,Uva,PÃO E CAFÉ,Contém glúten no pão e no macarrão à primavera. Contém lactose no macarrão à primavera.
2017-12-05,ARROZ E FEIJÃO,Bife à pizzaiolo,--,Alface,Iogurte,Caju,PÃO E CAFÉ,Contém glúten no pão. Contém lactose no bife à pizzaiolo e no iogurte.
2017-12-06,ARROZ E FEIJÃO,Frango assado,Cuscuz de legumes,Escarola,Banana,Maracujá,PÃO E CAFÉ,Contém glúten no pão. Não contém lactose.
2017-12-07,ARROZ E FEIJÃO,Isca de carne ao molho rosê,---,Alface,Maçã,Limão,PÃO E CAFÉ,Contém glúten no pão. Contém lactose na isca de carne ao molho rosê.
2017-12-08,ARROZ E FEIJÃO,Carne em cubos com abóbora,--,Alface,Melancia,Tangerina,PÃO E CAFÉ,Contém glúten no pão. Não contém lactose.
2017-12-11,ARROZ E FEIJÃO,Linguiça toscana,Cenoura à bechamel,Acelga,Iogurte,Laranja,PÃO E CAFÉ,Contém glúten no pão. Contém lactose na cenoura à bechamel e no iogurte.
2017-12-13,ARROZ E FEIJÃO,Bife à pizzaiolo,Purê de batata,Pepino,Banana,Abacaxi,PÃO E CAFÉ,Contém glúten no pão. Contém lactose no bife à pizzaiolo.
2017-12-14,ARROZ E FEIJÃO,Peixe frito,Creme de milho,Almeirão com laranja,Pudim de chocolate,Uva,PÃO E CAFÉ,"Contém glúten no pão, no peixe frito e no creme de milho. Contém lactose no creme de milho e no pudim de chocolate."
2017-12-15,ARROZ E FEIJÃO,Carne assada ao molho de tomate,Farofa agridoce,Repolho,Pudim de chocolate,Caju,PÃO E CAFÉ,Contém glúten no pão. Contém lactose no pudim de chocolate.
2017-12-18,ARROZ E FEIJÃO,Bife à milanesa,Creme de milho,Escarola,Laranja,Maracujá,PÃO E CAFÉ,"Contém glúten no pão, bife à milanesa e creme de milho. Contém lactose no bife à milanesa e creme de milho."
2017-12-19,ARROZ E FEIJÃO,Frango frito,Polenta cremosa,Berinjela à escabeche,Maçã,Limão,PÃO E CAFÉ,Contém glúten no pão. Não contém lactose.
2017-12-20,ARROZ E FEIJÃO,Escondidinho de carne,Escarola refogada,Acelga com abacaxi,Salada de frutas,Tangerina,PÃO E CAFÉ,Contém glúten no pão. Contém lactose no escondidinho de carne.
2017-12-21,ARROZ E FEIJÃO,Bife ao molho,--,Tomate,Uva,Laranja,PÃO E CAFÉ,Contém glúten no pão. Não contém lactose.
2018-01-04,ARROZ E FEIJÃO,Carne picada com mandioquinha e vagem,------,Alface,Uva,Maracujá,PÃO E CAFÉ,Contém glúten no pão. Não contém lactose.
2018-01-05,ARROZ E FEIJÃO,Omelete de forno,Abobrinha refogada,Repolho,Maçã,Laranja,PÃO E CAFÉ,Contém glúten no pão e no omelete de forno. Não contém lactose.
2018-01-08,ARROZ E FEIJÃO,Bife à milanesa,Polenta ao sugo,Tomate,Maçã,Cajú,PÃO E CAFÉ,Contém glúten no pão e no bife à milanesa. Contém lactose no bife à milanesa.
2018-01-09,ARROZ E FEIJÃO,Linguiça toscana assada,"Farofa com ovos, milho, tomate e azeitona",Alface,Laranja pera,Uva,PÃO E CAFÉ,Contém glúten no pão. Contém lactose na farofa.
2018-01-10,ARROZ E FEIJÃO,Carne picada à primavera,------,Tomate,Maçã,Limão,PÃO E CAFÉ,Contém glúten no pão. Não contém lactose.
2018-01-11,ARROZ E FEIJÃO,Frango ao molho rosê,Macarrão ao alho e óleo,Escarola,Melancia,Tangerina,PÃO E CAFÉ,"Contém glúten no pão, no frango ao molho rosê e no macarrão ao alho e óleo. Contém lactose no frango ao molho rosê."
2018-01-15,ARROZ E FEIJÃO,Bisteca suína frita,Polenta ao sugo,Alface,Laranja pera,Abacaxí,PÃO E CAFÉ,Contém glúten no pão. Não contém lactose.
2018-01-16,ARROZ E FEIJÃO,Carne em cubos com legumes,------,Pepino,Maçã,Laranja,PÃO E CAFÉ,Contém glúten no pão. Não contém lactose.
2018-01-17,ARROZ E FEIJÃO,Frango assado,------,Berinjela,Banana nanica,Laranja,PÃO E CAFÉ,Contém glúten no pão. Não contém lactose.
2018-01-18,ARROZ E FEIJÃO,bife à milanesa,------,de batata cozida,melancia,de tangerina,PÃO E CAFÉ,Contém glúten no pão e no bife à milanesa. Contém lactose no bife à milanesa.
2018-01-22,ARROZ E FEIJÃO,Isca de carne acebolada,Creme de milho,Escarola com laranja,Maçã,Tangerina,PÃO E CAFÉ,Contém glúten no pão e no creme de milho. Contém lactose no creme de milho.
2018-01-23,ARROZ E FEIJÃO,Frango assado,Quiabo refogado,Repolho bicolor,Banana nanica,Abacaxí,PÃO E CAFÉ,Contém glúten no pão. Não contém lactose.
2018-01-24,ARROZ E FEIJÃO,"Carne em cubos com vagem, cenoura e tomate",Macarrão ao sugo,Alface,Laranja pera,Uva,PÃO E CAFÉ,Contém glúten no pão e no macarrão ao sugo. Não contém lactose.
2018-01-25,ARROZ E FEIJÃO,Peixe frito,Cenoura refogada,Acelga,Maçã,Uva,PÃO E CAFÉ,Contém glúten no pão e no peixe frito. Não contém lactose.
2018-01-26,ARROZ E FEIJÃO,Carne assada ao molho de tomate,Farofa,Beterraba cozida,Doce de abóbora em calda,Tangerina,PÃO E CAFÉ,Contém glúten no pão. Contém lactose na farofa.
2018-01-29,ARROZ E FEIJÃO,Quibe assado,Macarrão ao alho e óleo,Pepino,Maçã,Uva,PÃO E CAFÉ,"Contém glúten no pão, quibe assado e macarrão ao alho e óleo. Não contém lactose."
2018-01-30,ARROZ E FEIJÃO,Carne desfiada ao vinagrete quente,Polenta cremosa,Alface,Doce de leite,Limão,PÃO E CAFÉ,Contém glúten no pão. Contém lactose no doce de leite.
2018-01-31,ARROZ E FEIJÃO,Nuggets assado,Purê de batata,Almeirão,Laranja pera,Limão,PÃO E CAFÉ,Contém glúten no pão e no nuggets. Contém lactose no nuggets e no purê de batata.
2018-02-01,ARROZ E FEIJÃO,Carne em cubos com mandioquinha,------,Escarola,Doce de abóbora em calda,Uva,PÃO E CAFÉ,Contém glúten no pão. Não contém lactose.
2018-02-05,ARROZ E FEIJÃO,Bife ao vinagrete quente,Macarrão ao alho e óleo,Repolho com maçã,Melancia,Manga,PÃO E CAFÉ,Contém glúten no pão e no macarrão ao alho e óleo. Não contém lactose.
2018-02-07,ARROZ E FEIJÃO,Carne em cubos com cenoura,------,Escarola com laranja,Figo em calda,Maracujá,PÃO E CAFÉ,Contém glúten no pão. Não contém lactose.
2018-02-09,ARROZ E FEIJÃO,Pernil desfiado ao vinagrete quente,Couve refogada,Beterraba cozida,Maçã,Cajú,PÃO E CAFÉ,Contém glúten no pão. Não contém lactose.
2018-02-22,ARROZ E FEIJÃO,Peixe frito,Creme de milho,Repolho Bicolor,Banana,Maracujá,PÃO E CAFÉ,Contém glúten no pão. Contém lactose no creme de milho.
2018-02-23,ARROZ E FEIJÃO,Linguiça toscana assada,Farofa,Alface,Goiabada,limão,PÃO E CAFÉ,Contém glúten no pão. contém ovos e na farofa.
2018-02-27,ARROZ E FEIJÃO,Frango assado,Espinafre refogado,beterraba ralada,Goaibada,Uva,PÃO E CAFÉ,Contém glúten no pão. Não contém lactose.
2018-02-28,ARROZ E FEIJÃO,Carne em cubos com batata,------,Acelga,Maçã,laranja,PÃO E CAFÉ,Contém glúten no pão. Não contém lactose.
2018-03-01,ARROZ E FEIJÃO,Peixe frito,------,Escarola / Grão de bico com ervilha e milho,Banana nanica,Maracujá,PÃO E CAFÉ,Contém glúten no pão e no peixe frito. Não contém lactose.
2018-03-02,ARROZ E FEIJÃO,Almôndegas ao molho,Farofa,Pepino,Gelatina sabor morango,Tangerina,PÃO E CAFÉ,Contém glúten no pão e na Almôndegas ao molho. Contém lactose na farofa.
2018-03-05,ARROZ E FEIJÃO,Nuggets assado,Creme de milho,Almeirão,Maçã,Manga,PÃO E CAFÉ,Contém glúten no pão.no Nuggets assado e creme de ervilha Contém lactose no creme de ervilha
2018-03-06,ARROZ E FEIJÃO,Isca de carne com mandioquinha,------,Acelga com agrião,Melancia,Laranja,PÃO E CAFÉ,Contém glúten no pão. Não contém lactose.
2018-03-07,ARROZ E FEIJÃO,Frango assado,Cenoura refogada,Abobrinha ralada ao vinagrete,Laranja,Abacaxi,PÃO E CAFÉ,Contém glúten no pão. Não contém lactose.
2018-03-08,ARROZ E FEIJÃO,Bife ao molho de azeitona,Repolho refogado,Alface,Banana nanica,Cajú,PÃO E CAFÉ,Contém glúten no pão. Não contém lactose.
2018-03-09,ARROZ E FEIJÃO,Paleta suína em cubos com linguiça e cenoura,-----,Couve,Iogurte,Limão,PÃO E CAFÉ,Contém glúten no pão. Contém lactose no iogurte.
2018-03-12,ARROZ E FEIJÃO,Strogonoff de carne,Batata chips,Alface,Laranja,Maracujá,PÃO E CAFÉ,Contém glúten no pão. Contém lactose no strogonoff de carne.
2018-03-13,ARROZ E FEIJÃO,Frango assado,Chuchu refogado,Repolho com maçã,Melancia,de Tangerina,PÃO E CAFÉ,Contém glúten no pão. Não contém ovos e lactose.
2018-03-14,ARROZ E FEIJÃO,Carne em cubos com legumes,-----,Berinjela á escabeche,Laranja pera,Limão,PÃO E CAFÉ,Contém glúten no pão. Não contém lactose.
2018-03-15,ARROZ E FEIJÃO,Ovo cozido,Abobrinha refogada,Acelga com cenoura,Banana nanica,Laranja,PÃO E CAFÉ,Contém glúten no pão. Não contém lactose.
2018-03-16,ARROZ E FEIJÃO,Carne em cubos com batata,-----,Mista verde,Iogurte,Abacaxi,PÃO E CAFÉ,Contém glúten no pão. Contém lactose no iogurte.
2018-03-20,ARROZ E FEIJÃO,Frango assado,Legumes misto,Legumes misto,Gelatina de cereja,Limão,PÃO E CAFÉ,Contém glúten no pão. Não contém lactose.
2018-03-21,ARROZ E FEIJÃO,Bife a milanesa,Escarola refogada,Almeirão,Laranja,Maracujá,PÃO E CAFÉ,Contém glúten no pão e no Bife à milanesa. Contém lactose no bife à milanesa.
2018-03-22,ARROZ E FEIJÃO,Steak assado,Polenta cremosa com queijo,Couve,Banana nanica,Tangerina,PÃO E CAFÉ,Contém glúten no pão e no steak assado. Contém lactose na polenta cremosa com queijo.
2018-03-23,ARROZ E FEIJÃO,Carne em cubos com legumes,-----,Couve com laranja,Doce de leite,Manga,PÃO E CAFÉ,Contém glúten no pão. Contém lactose no doce de leite.
2018-03-26,ARROZ E FEIJÃO,Salsicha ao molho de tomate,Purê de batata,Escarola,Maçã,Laranja,PÃO E CAFÉ,Contém glúten no pão. Contém lactose no purê.
2018-03-27,ARROZ E FEIJÃO,Carne em cubos com mandioquinha,-----,acelga,Barra de cereal,Abacaxí,PÃO E CAFÉ,Contém glúten no pão. Não contém lactose.
2018-04-03,ARROZ E FEIJÃO,Bife acebolado,------,Tomate com azeitona,Maçã,Uva,PÃO E CAFÉ,Contém glúten no pão. Não contém lactose.
2018-04-04,ARROZ E FEIJÃO,Linguiça de frango assada,Farofa,Escarola,Banana nanica,Abacaxi,PÃO E CAFÉ,Contém glúten no pão. Não contém lactose.
2018-04-05,ARROZ E FEIJÃO,Carne em cubos com vagem,-----,Alface,Laranja pera,Manga,PÃO E CAFÉ,Contém glúten no pão. Não contém lactose.
2018-04-06,ARROZ E FEIJÃO,Pernil desfiado ao vinagrete,Polenta cremosa com queijo,Couve,Melancia,Tangerina,PÃO E CAFÉ,Contém glúten no pão. Contém lactose na polenta cremosa com queijo.
2018-04-09,ARROZ E FEIJÃO,Carne picada com batata,-----,Almeirão,Laranja pera,Maracujá,PÃO E CAFÉ,Contém glúten no pão. Não contém lactose.
2018-04-10,ARROZ E FEIJÃO,Frango assado,Quibebe,Acelga com beterraba,Arroz doce,Uva,PÃO E CAFÉ,Contém glúten no pão. Contém lactose no arroz doce.
2018-04-11,ARROZ E FEIJÃO,Bisteca suína assada,Berinjela refogada,Acelga com escarola,Banana nanica,Limão,PÃO E CAFÉ,Contém glúten no pão. Não contém lactose.
2018-04-12,ARROZ E FEIJÃO,Isca de carne com cenoura,-----,Repolho bicolor,Laranja,Abacaxi,PÃO E CAFÉ,Contém glúten no pão. Não contém ovos e lactose.
2018-04-13,ARROZ E FEIJÃO,Almôndegas ao sugo,Creme de ervilha,Pepino,Maçã,Manga,PÃO E CAFÉ,"Contém glúten no pão, na almôndegas ao sugo e no creme de ervilha. Contém lactose no creme de ervilha."
2018-04-16,ARROZ E FEIJÃO,Quibe assado,Abobrinha refogada,Beterraba ralada,Goiabada,Tangerina,PÃO E CAFÉ,Contém glúten no pão e no quibe assado. Não contém lactose.
2018-04-17,ARROZ E FEIJÃO,Frango assado,Escarola refogada,Couve,Curau,Maracujá,PÃO E CAFÉ,Contém glúten no pão e no curau. Contém lactose no curau.
2018-04-18,ARROZ E FEIJÃO,Paleta suína em cubos com mandioquinha,-----,Chuchu / almeirão,Maçã,Cajú,PÃO E CAFÉ,Contém glúten no pão. Não contém lactose.
2018-04-19,ARROZ E FEIJÃO,Isca de frango ao molho rosê,Batata refogada,Alface,Banana nanica,Limão,PÃO E CAFÉ,Contém glúten no pão e na isca de frango ao molho rosê. Contém lactose na isca de frango ao molho rosê.
2018-04-23,ARROZ E FEIJÃO,Salsicha ao sugo,Chuchu refogado,beterraba ralada,Iogurte,Abacaxi,PÃO E CAFÉ,Contém glúten no pão. Contém lactose no iogurte.
2018-04-24,ARROZ E FEIJÃO,Bife ao vinagrete quente,-----,Alface com rabanete,Maçã,Limão,PÃO E CAFÉ,Contém glúten no pão. Não contém lactose.
2018-04-26,ARROZ E FEIJÃO,Carne em cubos com batata,-----,Almeirão com cenoura,Iogurte,Maracujá,PÃO E CAFÉ,Contém glúten no pão. Contém lactose no iogurte.
2018-05-02,ARROZ E FEIJÃO,Almôndegas ao sugo,Polenta cremosa,Repolho bicolor,Maçã,Acerola,PÃO E CAFÉ,Contém glúten no pão e nas almôndegas ao sugo. Não contém lactose.
2018-05-03,ARROZ E FEIJÃO,Nuggets assado,Escarola refogada,Acelga,Curau,Tangerina,PÃO E CAFÉ,"Contém glúten no pão, no nuggets assado e no curau. Contém lactose no nuggets assado e no curau."
2018-05-04,ARROZ E FEIJÃO,Pernil desfiado ao vinagrete quente,Farofa,Alface,Tangerina ponkan,Limão,PÃO E CAFÉ,Contém glúten no pão. Não contém lactose.
2018-05-07,ARROZ E FEIJÃO,Bisteca suína frita,Quibebe,Couve,Laranja pera,Abacaxí,PÃO E CAFÉ,Contém glúten no pão. Não contém lactose.
2018-05-08,ARROZ E FEIJÃO,Isca de frango ao molho vermelho,Polenta cremosa,Almeirão,Maçã,Laranja,PÃO E CAFÉ,Contém glúten no pão. Não contém lactose.
2018-05-09,ARROZ E FEIJÃO,Paleta bovina em cubos com batata doce,-----,Alface,Banana nanica,Maracujá,PÃO E CAFÉ,Contém glúten no pão. Não contém lactose.
2018-05-10,ARROZ E FEIJÃO,Nuggets assado,Creme de milho,Acelga,Doce de leite,Cajú,PÃO E CAFÉ,"Contém glúten no pão, no nuggets assado e no creme de milho. Contém lactose no nuggets assado, no creme de milho e no doce de leite."
2018-05-11,ARROZ E FEIJÃO,Linguiça de frango assada,Quibebe,Alface,Doce de goiaba,Uva,PÃO E CAFÉ,Contém glúten no pão. Não contém lactose.
2018-05-14,ARROZ E FEIJÃO,Carne em cubos com legumes,-----,Abobrinha cozida,Maçã,Manga,PÃO E CAFÉ,Contém glúten no pão. Não contém lactose.
2018-05-15,ARROZ E FEIJÃO,Frango assado,-----,Batata com cenoura,Laranja pera,Acerola,PÃO E CAFÉ,Contém glúten no pão. Não contém lactose.
2018-05-17,ARROZ E FEIJÃO,Quibe assado,Macarrão ao sugo,Escarola,Maçã,Limão,PÃO E CAFÉ,"Contém glúten no pão, no quibe assado e no macarrão ao sugo. Não contém lactose."
