Data,Acompanhamentos,Prato Principal,Guarnição,Salada,Sobremesa,Refresco,Extra,Nota Técnica
2014-01-02,ARROZ E FEIJÃO,LINGUIÇA ASSADA ACEBOLADA,POLENTA AO SUGO,REPOLHO CENOURA RALADA,DOCE DE MAMÃO,CAJÚ,PÃO E CAFÉ,
2014-01-03,ARROZ E FEIJÃO,BIFE AO MOLHO MADEIRA,QUIBEBE,"ALFACE/CHUCHU COM OVOS,CEBOLA RALADA E CHEIRO VERD",SAGÚ,TANGERINA,PÃO E CAFÉ,
2014-01-06,ARROZ E FEIJÃO,COPA LOMBO AO MOLHO DE LIMÃO,VIRADO DE FOLHAS,CHICÓRIA/PEPINO,MELÃO,MARACUJÁ,PÃO E CAFÉ,
2014-01-07,ARROZ E FEIJÃO,"COZIDO A PORTUGUESA(CARNE BOVINA ,BACON,PIMENTÃO,",ACELGA REFOGADA,"ALMEIRÃO,MACARRONESE",GELATINA DE MORANGO,ABACAXI,PÃO E CAFÉ,
2014-01-08,ARROZ E FEIJÃO,STEAK DE FRANGO A PIZZAIOLO,CENOURA SAUTÊ,ESCAROLA/BATATA,BANANA,LARANJA,PÃO E CAFÉ,
2014-01-09,ARROZ E FEIJÃO,STROGONOFF DE CARNE,BATATA PALHA,ALFACE/ABOBRINHA,PUDIM DE CHOCOLATE,LIMÃO,PÃO E CAFÉ,
2014-01-10,ARROZ E FEIJÃO,FILÉ DE FRANGO AO MOLHO DE MOSTARDA,REPOLHO REFOGADO,"CHICÓRIA/SALADA DELICIA(QUIABO,PIMENTÕES E MUSSA",MAÇÃ,CAJÚ,PÃO E CAFÉ,
2014-01-13,ARROZ E FEIJÃO,FILÉ DE PESCADA AO MOLHO DE MARACUJÁ,PIRÃO,ACELGA/CHUCHU COM AZEITONAS,MELANCIA,TANGERINA,PÃO E CAFÉ,
2014-01-14,ARROZ E FEIJÃO,LAGARTO RECHEADO AO MOLHO ROTY,"CAPONATA DE BERINJELA(berinjela,pimentões,cebola",ALFACE/PEPINO,BANANA,ABACAXI,PÃO E CAFÉ,
2014-01-15,ARROZ E FEIJÃO,"CARNE MOIDA COM CENOURA,MILHO,ERVILHA E OVOS",MACARRÃO AO MOLHO BRANCO,CATALONHA/ABÓBRINHA ASSADA,SALADA DE FRUTAS,LIMÃO,PÃO E CAFÉ,
2014-01-16,ARROZ E FEIJÃO,PERNIL AO MOLHO DE ALHO PORÓ,"FAROFA RICA(ovos,milho,ervilha e azeitonas)",RÚCULA/CEBOLA ASSADA,MELÃO,MARACUJÁ,PÃO E CAFÉ,
2014-01-17,ARROZ E FEIJÃO,CUBOS DE CARNE COM MANDIOCA E AZEITONA,CHUCHU AO BACON,COUVE/BETERRABA COZIDA,CREME DE BAUNILHA COM ABACAXI,LIMÃO,PÃO E CAFÉ,
2014-01-20,ARROZ E FEIJÃO,BIFE ACEBOLADO,CUSCUZ MOLE,REPOLHO BICOLOR/TOMATE,MAX GOIABINHA,MANGA,PÃO E CAFÉ,
2014-01-21,ARROZ E FEIJÃO,COXA DE FRANGO AO ALECRIM,BATATA GRATINADA,MIX DE FOLHAS/PEPINO,MIXIRICA,CAJÚ,PÃO E CAFÉ,
2014-01-22,ARROZ E FEIJÃO,KIBE ASSADO,REPOLHO VERDE,ALFACE/TABULE,BANANA,TANGERINA,PÃO E CAFÉ,
2014-01-23,ARROZ E FEIJÃO,BIFE APIZZAIOLO,VAGEM COM CENOURA SAUTÊ,CHICÓRIA /MACARRONESE,IOGURTE,UVA,PÃO E CAFÉ,
2014-01-24,ARROZ E FEIJÃO,FILÉ DE FRANGO ACEBOLADO,CREME DE ERVILHA,ESCAROLA/VINAGRETE,MAMÃO,LIMÃO,PÃO E CAFÉ,
2014-01-27,ARROZ E FEIJÃO,Almôndega,ESCAROLA REPOLHO E ACELGA REPOLHO REFOGADAS,ACELGA COM OREGANO/SALADA TRICOLOR,BARRINHA DE CEREAL,MARACUJÁ,PÃO E CAFÉ,
2014-01-28,ARROZ E FEIJÃO,BIFE ACEBOLADO,COUVE FLOR SAUTÊ,ALFACE AMERICANA/TRIGO EM GRÃOS AO VINAGRETE,SORVETE,ABACAXI,PÃO E CAFÉ,
2014-01-29,ARROZ E FEIJÃO,SALSICHA A PAMODORO,PURÊ DE BATATA,ALMEIRÃO/BERINJELA TEMPERADA,Melão,MANGA,PÃO E CAFÉ,
2014-01-30,ARROZ E FEIJÃO,COPA LOMBO ASSADO,"FAROFA RICA(ovos,milho,ervilha e azeitonas)",TOMATE (COUVE MANTEIGA COM LARANJA EM CUBOS),GELATINA DE UVA,LIMÃO,PÃO E CAFÉ,
2014-01-31,ARROZ E FEIJÃO,LASANHA A BOLONHESA,ACELGA REFOGADA,ALFACE/BETERRABA RALADA,MAMÃO,MARACUJÁ,PÃO E CAFÉ,
2014-02-03,ARROZ E FEIJÃO,ALMONDEGAS AO MOLHO SUGO,POLENTA CREMOSA COM QUEIJO,REPOLHO CENOURA RALADA,DOCE DE ABÓBORA COM COCO,CAJÚ,PÃO E CAFÉ,
2014-02-04,ARROZ E FEIJÃO,FILÉ DE FRANGO ACEBOLADO,ABÓBORA REFOGADA,RÚCULA/TOMATE,MAÇÃ,TANGERINA,PÃO E CAFÉ,
2014-02-05,ARROZ E FEIJÃO,"PICADINHO A PROVENÇAL ( ACEM,CEBOLA,PIMENTAO E TO","FAROFA RICA(ovos,milho,ervilha e azeitonas)",ALFACE/GRÃO DE BICO CCOM VINAGRETE,GELATINA DE LIMÃO,ABACAXI,PÃO E CAFÉ,
2014-02-06,ARROZ E FEIJÃO,PERNIL EM CUBOS,COUVE REFOGADA,CHICÓRIA/CHUCHU NA SALSA,GELATINA DE LIMÃO,ABACAXI,PÃO E CAFÉ,
2014-02-07,ARROZ E FEIJÃO,"BIFE A GIRARDELLI (TOMATE,MOLHO ALHO E PRESUNTO EM","CAPONATA DE BERINJELA(berinjela,pimentões,cebola",ESCAROLA/PEPINO,LARANJA,LIMÃO,PÃO E CAFÉ,
2014-02-10,ARROZ E FEIJÃO,STROGONOFF DE CARNE,BATATA PALHA,ACELGA/NABO COM SHOYO,BARRINHA DE CEREAL,MARACUJÁ,PÃO E CAFÉ,
2014-02-11,ARROZ E FEIJÃO,FILÉ DE PESCADA A PORTUGUESA,BATATA CORADA,ALMEIRÃO/COUVE FLOR,ABACAXI,LARANJA,PÃO E CAFÉ,
2014-02-12,ARROZ E FEIJÃO,LAGARTO ASSADO AO MOLHO MADEIRA,"VIRADO DE REPOLHO,AZEITONA E MILHO",AGRIÃO/TOMATE,MELANCIA,MANGA,PÃO E CAFÉ,
2014-02-13,ARROZ E FEIJÃO,COXA DE FRANGO AO ALECRIM,MACARRÃO AO SUGO,ALFACE/ABOBRINHA ASSADA,PUDIM DE MORANGO,CAJÚ,PÃO E CAFÉ,
2014-02-14,ARROZ E FEIJÃO,LINGUICA TOSCANA ASSADA,QUIBEBE,MIX DE FOLHAS/RABANETE,BANANA,TANGERINA,PÃO E CAFÉ,
2014-02-17,ARROZ E FEIJÃO,FILÉ DE FRRANGO AO MOLHO DE MOSTARDA,CENOURA SAUTÊ,REPOLHO/TABULE,SORVETE DE MASSA,UVA,PÃO E CAFÉ,
2014-02-18,ARROZ E FEIJÃO,"CARNE MOIDA COM LEGUMES(CENOURA,BATATA,MILHO E ERV",REPOLHO REFOGADA COM BACON,RÚCULA /ABÓBORA TEMPERADA,BARRINHA DE CEREAL,MANGA,PÃO E CAFÉ,
2014-02-19,ARROZ E FEIJÃO,BIFE A PIZZAIOLO,RISOTO A JARDINEIRA,ALFACE/TOMATE,MAMÃO,LIMÃO,PÃO E CAFÉ,
2014-02-20,ARROZ E FEIJÃO,COXA DE FRANGO CROCANTE(FARINHA DE MILHO TEMPERAD,LEGUMES NA MANTEIGA,CHICÓRIA/PEPINO,DOCE DE Abóbora,MARACUJÁ,PÃO E CAFÉ,
2014-02-21,ARROZ E FEIJÃO,CARNE ASSADA AO MOLHO MADEIRA,"FAROFA RICA(OVOS,MILHO ERVILHA E AZEITONA)",ESCAROLA/CHUCHU NA SALSA,MELÃO,LARANJA,PÃO E CAFÉ,
2014-02-24,ARROZ E FEIJÃO,SALSICHA AO MOLHO,PURÊ A CABOCLA (BATATA ABÓBORA),ACELGA/BETERRABA RALADA,SAGÚ,MANGA,PÃO E CAFÉ,
2014-02-25,ARROZ E FEIJÃO,FILÉ DE FRANGO GRATINADO,VAGEM COM CENOURA SAUTÊ,ALMEIRÃO/BATATA BOLINHA AO VINAGRETE,IOGURTE,CAJÚ,PÃO E CAFÉ,
2014-02-26,ARROZ E FEIJÃO,COPA LOMBO AO MOLHO DE LIMÃO,CUSCUZ MOLE,AGRIÃO/VINAGRETE,MELANCIA,TANGERINA,PÃO E CAFÉ,
2014-02-27,ARROZ E FEIJÃO,LASANHA,CHUCHU COM OVOS,ALFACE/TOMATE,CURAU,UVA,PÃO E CAFÉ,
2014-02-28,ARROZ E FEIJÃO,CUBOS DE CARNE COM AZEITONAS,"FAROFA RICA(ovos,milho,ervilha e azeitonas)",MIX DE FOLHAS/FEIJÃO BRANCO TEMPERADO,MAÇÃ,ABACAXI,PÃO E CAFÉ,
2014-03-03,ARROZ E FEIJÃO,STEAK A PIZZAIOLO,ABOBRINHA SAUTÊ,ACELGA/CENOURA RALADA,SORVETE DE MASSA,CAJÚ,PÃO E CAFÉ,
2014-03-04,ARROZ E FEIJÃO,CARNE ASSADA AO MOLHO SHOYO,"FAROFA RICA(OVOS, MILHO ERVILHA E AZEITONA",AGRIÃO/TOMATE,ABACAXI,TANGERINA,PÃO E CAFÉ,
2014-03-05,ARROZ E FEIJÃO,FILE DE FRANGO GRATINADO,CHUCHU NA SALSA,ALFACE/BATATA DOCE COM SALSÃO,PUDIM DE SPLITE,UVA,PÃO E CAFÉ,
2014-03-06,ARROZ E FEIJÃO,CUBOS DE CARNE COM MANDIOCA,"JARDINEIRA DE LEGUMES(BATATA,ERVILHA.MILHO,CENOURA",ALMEIRÃO/LENTILHA TEMPERADA,MAÇÃ,ABACAXI,PÃO E CAFÉ,
2014-03-07,ARROZ E FEIJÃO,PERNIL ASSADO AO MOLHO DE ABACAXI,COUVE REFOGADA,CATALONIA/PEPINO,CURAU,LIMÃO,PÃO E CAFÉ,
2014-03-10,ARROZ E FEIJÃO,STROGONOFF DE CARNE,BATATA PALHA,REPOLHO BICOLOR/BETERRABA RALADA,GOIABA,MARACUJÁ,PÃO E CAFÉ,
2014-03-11,ARROZ E FEIJÃO,ROLÊ DE FRANGO RECHEADO,VAGEM COM CENOURA REFOGADOS,CHICÓRIA/ABÓBORA TEMPERADA,LARANJA,ABACAXI,PÃO E CAFÉ,
2014-03-12,ARROZ E FEIJÃO,BIFE ACEBOLADO,"CAPONATA DE BERINJELA(BERINJELA,PIMENTÕES,CEBOLA",COUVE MANTEIGA/TABULE,SAGÚ,MANGA,PÃO E CAFÉ,
2014-03-13,ARROZ E FEIJÃO,COXA DE FRANGO AO ALECRIM,FAROFA,ESCAROLA/TOMATE,BANANA,CAJÚ,PÃO E CAFÉ,
2014-03-14,ARROZ E FEIJÃO,LINGUIÇA ASSADA,MACARRÃO AO ALHO E OLEO,ALMEIRÃO/CENOURA RALADA,SPUMONE,TANGERINA,PÃO E CAFÉ,
2014-03-17,ARROZ E FEIJÃO,FALSA BACALHOADA,CUSCUZ MOLE,CENOURA SAUTÊ,BARRINHA DE CEREAL,UVA,PÃO E CAFÉ,
2014-03-18,ARROZ E FEIJÃO,LAGARTO AO MOLHO MADEIRA,FAROFA DE BANANA,RÚCULA/CHUCHU COM OVOS,FLAN DE CARAMELO,ABACAXI,PÃO E CAFÉ,
2014-03-19,ARROZ E FEIJÃO,CARNE PICADA COM CENOURA,--,ESCAROLA COM ABACAXI,MAÇÃ,LARANJA,PÃO E CAFÉ,
2014-03-21,ARROZ E FEIJÃO,Frango ao molho,Quibebe,Escarola com laranja,Maçã,,PÃO E CAFÉ,
2014-03-24,ARROZ E FEIJÃO,Bife ao molho primavera,------,Beterraba e cenoura ralada/agrião ao vinagrete,Banana nanica,manga,PÃO E CAFÉ,
2014-03-26,ARROZ E FEIJÃO,Cozido misto (patinho em cubos/paleta suina com le,-------,Mista verde,Laranja,acerola,PÃO E CAFÉ,
2014-03-27,ARROZ E FEIJÃO,Carne picada com legumes,Escarola refogada,Pepino,Maçã,Laranja,PÃO E CAFÉ,
2014-03-28,ARROZ E FEIJÃO,FRANGO FRITO,ACELGA /REPOLHO/CENOURA REFOGADO,CHICÓRIA/VINAGRETE,BANANA,SUCO DE MANGA,PÃO E CAFÉ,
2014-03-31,ARROZ E FEIJÃO,Salsicha ao sugo,-------,Multicor com beterraba,Maçã,Manga,PÃO E CAFÉ,
2014-04-03,ARROZ E FEIJÃO,Isca de frango com legumes,--,Beterraba ralada/Pepino,Laranja,Abacaxi,PÃO E CAFÉ,
2014-04-04,ARROZ E FEIJÃO,CUBOS DE CARNE COM AZEITONAS,BATATA SAUTÊ,ESCAROLA/PEPINO,MELANCIA,LARANJA,PÃO E CAFÉ,
2014-04-06,ARROZ E FEIJÃO,CARNE PICADA COM CENOURA E VAGEM,-,ACELGA/NABO COM SHOYO,BANANA,LARANJA,PÃO E CAFÉ,
2014-04-07,ARROZ E FEIJÃO,Frango ao molho,-,Alface /Acelga,Maçã,Maracujá,PÃO E CAFÉ,
2014-04-08,ARROZ E FEIJÃO,BIFE ACEBOLADO,CENOURA E VAGEM,ALMEIRÃO E ALFACE/VINAGRETE,LARANJA PERA,ACEROLA,PÃO E CAFÉ,
2014-04-09,ARROZ E FEIJÃO,Carne á portuguesa,-,"MULTICOR Salada multicor (folhas verdes, maçã, cenoura ralada e milho)",Melancia,Laranja,PÃO E CAFÉ,
2014-04-10,ARROZ E FEIJÃO,ISCA DE FRANGO,ABOBRINHA REFOGADA,ESCAROLA/BETERRABA RALADA,BANANA,ACEROLA,PÃO E CAFÉ,
2014-04-11,ARROZ E FEIJÃO,CARNE COM MANDIOCA E CALABRESA,COUVE REFOGADA,ALFACE COM CEBOLA,BANANA,LARANJA,PÃO E CAFÉ,
2014-04-14,ARROZ E FEIJÃO,STROGONOFF DE CARNE,BATATA FRITA,ALFACE /VINAGRETE,MAÇÃ,MARACUJÁ,PÃO E CAFÉ,
2014-04-15,ARROZ E FEIJÃO,FRANGO AO MOLHO ESCABECHE,-,ACELGA COM AGRIÃO,BANANA,UVA,PÃO E CAFÉ,
2014-04-16,ARROZ E FEIJÃO,ISCA DE CARNE À MILANESA,ACELGA REFOGADA,BETERRABA,PUDIM DE COCO COM PASSAS,LIMÃO,PÃO E CAFÉ,
2014-04-22,ARROZ E FEIJÃO,NUGGETS,CREME DE MILHO,SELVAGEM,LARANJA,ABACAXI,PÃO E CAFÉ,
2014-04-23,ARROZ E FEIJÃO,BIFE CAMPONÊS,CHUCHU REFOGADO,ALFACE/VINAGRETE,DOCE DE BANANA,LARANJA,PÃO E CAFÉ,
2014-04-24,ARROZ E FEIJÃO,FRANGO FRITO,QUIABO REFOGADO,VERÃO /ALFACE COM VINAGRETE,MAÇÃ,MARACUJÁ,PÃO E CAFÉ,
2014-04-25,ARROZ E FEIJÃO,COZIDO MISTO COM LEGUMES,-,ESCAROLACOM VINAGRETE/PEPINO,BANANA,UVA,PÃO E CAFÉ,
2014-04-28,ARROZ E FEIJÃO,ISCA DE CARNE COM CENOURA,-,TOMATE/COUVE MANTEIGA COM VINAGRETE,LARANJA,ABACAXI,PÃO E CAFÉ,
2014-04-29,ARROZ E FEIJÃO,PALETA SUÍNA,ABÓBORA REFOGADA,ALFACE/VINAGRETE,DOCE DE BANANA,MANGA,PÃO E CAFÉ,
2014-04-30,ARROZ E FEIJÃO,BIFE A FRANCESA,ABOBRINHA REFOGADA,ESCAROLACOM VINAGRETE/PEPINO,SAGÚ,,PÃO E CAFÉ,
2014-05-05,ARROZ E FEIJÃO,Salsicha ao sugo,Purê de batata,Escarola com nabo e vinagrete,Laranja pera,Maracujá,PÃO E CAFÉ,
2014-05-06,ARROZ E FEIJÃO,Carne picada com cenoura,-----,Repolho com tomate,Maçã,abacaxí,PÃO E CAFÉ,
2014-05-07,ARROZ E FEIJÃO,Bife à milanesa,Berinjela ao molho,verde (alface/escarola/pepino/acelga) e vinagrete,Banana nanica,Manga,PÃO E CAFÉ,
2014-05-08,ARROZ E FEIJÃO,Rolê bovino ao molho de tomate,Quibebe,Repolho liso / rabanete,Melancia,Tangerina,PÃO E CAFÉ,
2014-05-09,ARROZ E FEIJÃO,Strogonoff de frango,Batata lisa frita,Alface,Laranja pera,Abacaxí,PÃO E CAFÉ,
2014-05-12,ARROZ E FEIJÃO,BIFE ACEBOLADO,CHUCHU AO MOLHO BECHAMEL,ESCAROLA/BETERRABA,MAÇÃ,CAJÚ,PÃO E CAFÉ,
2014-05-13,ARROZ E FEIJÃO,PALETA SUÍNA ACEBOLADA,BATATA SAUTÊ,TOMATE /BERINJELS COM VINAGRETE,LARANJA,MARACUJÁ,PÃO E CAFÉ,
2014-05-14,ARROZ E FEIJÃO,COZIDO MISTO,-,ALMEIRÃO/VINAGRETE,MELANCIA,,PÃO E CAFÉ,
2014-05-15,ARROZ E FEIJÃO,FRANGO FRITO,BERINJELA REFOGADA,ALFACE /ALMEIRÃO/VINAGRETE,LARANJA,CAJÚ,PÃO E CAFÉ,
2014-05-16,ARROZ E FEIJÃO,PERNIL AO VINAGRETE QUENTE,FAROFA DE FRUTAS,AGRIÃO/ALFACE,MAÇÃ,TANGERINA,PÃO E CAFÉ,
2014-05-19,ARROZ E FEIJÃO,SALSICHA AO SUGO,MACARRÃO AO ALHO E OLEO,AGRIÃO COM TOMATE,LARANJA,ABACAXI,PÃO E CAFÉ,
2014-05-20,ARROZ E FEIJÃO,ISCA DE CARNE COM AZEITONA,ESCAROLA REFOGADA,ALMEIRÃO COM CENOURA/AGRIÃO/RABANETE/VINAGRETE,MELANCIA,CAJÚ,PÃO E CAFÉ,
2014-05-21,ARROZ E FEIJÃO,NUGGETS,MANDIOQUINHA SAUTÊ,ALFACE/AGRIÃO/RÚCULA/ALMEIRÃO,TANGERINA,MANGA,PÃO E CAFÉ,
2014-05-22,ARROZ E FEIJÃO,ISCA DE FRANGO A SUIÇA,-,"MISTA VERDE COM VINAGRETE(ALFACE,ESCAROLA,ALMEIRÃO)",MAÇÃ,TANGERINA,PÃO E CAFÉ,
2014-05-23,ARROZ E FEIJÃO,FEIJOADA,COUVE REFOGADA,ALFACE,TANGERINA,ABACAXI,PÃO E CAFÉ,
2014-05-26,ARROZ E FEIJÃO,ISCA DE CARNE COM LEGUMES,-,Alface,MAÇÃ,Acerola,PÃO E CAFÉ,
2014-05-27,ARROZ E FEIJÃO,BIFE ACEBOLADO,ABOBRINHA REFOGADA,SELVAGEM,PUDIM DE CHOCOLATE,TANGERINA,PÃO E CAFÉ,
2014-05-28,ARROZ E FEIJÃO,FRANGO FRITO (sobrecoxa),POLENTA AO SUGO,ESCAROLA,SALADA DE FRUTA,ACEROLA,PÃO E CAFÉ,
2014-05-29,ARROZ E FEIJÃO,STROGONOFF DE CARNE BOVINA,BATATA FRITA,ALFACE COM VINAGRETE,SAGU,CAJU,PÃO E CAFÉ,
2014-05-30,ARROZ E FEIJÃO,Cozido misto,----,Tomate/escarola,Laranja pera,,PÃO E CAFÉ,
2014-06-02,ARROZ E FEIJÃO,BIFE AO CURRY,MACARRÃO COM ESPINAFRE,ALMEIRÃO,LARANJA PERA,Limão,PÃO E CAFÉ,
2014-06-03,ARROZ E FEIJÃO,FRANGO FRITO,BERINJELA REFOGADA COM TOMATE,CENOURA COM MAÇÃ / BETERRABA RALADA,BANANA NANICA,MARACUJÁ,PÃO E CAFÉ,
2014-06-04,ARROZ E FEIJÃO,CARNE PICADA COM BATATA E CENOURA,------,ALFACE,SAGU,LARANJA,PÃO E CAFÉ,
2014-06-05,ARROZ E FEIJÃO,ISCA DE CARNE COM BATATA,-----,ABOBRINHA RALADA COM ALFACE,MAÇÃ,,PÃO E CAFÉ,"Ocorreu alteração de mandioca para batata no prato principal, dedido a problemas no fornecimento."
2014-06-06,ARROZ E FEIJÃO,Frango ao molho,Quiabo refogado,Escarola / beterraba,Iogurte,Maracujá,PÃO E CAFÉ,
2014-06-09,ARROZ E FEIJÃO,CARNE PICADA COM MANDIOQUINHA,------,ALFACE,MAÇÃ,LARANJA,PÃO E CAFÉ,
2014-06-10,ARROZ E FEIJÃO,NUGGETS,ABOBÓRA REFOGADA,ESCAROLA COM RABANETE/ALFACE COM VINAGRETE,LARANJA,UVA,PÃO E CAFÉ,
2014-06-11,ARROZ E FEIJÃO,CARNE EM CUBOS COM VAGEM E CENOURA,------,COUVE COM LARANJA,MELANCIA,LARANJA,PÃO E CAFÉ,
2014-06-13,ARROZ E FEIJÃO,ISCA DE CARNE COM BATATA,------,ALMEIRÃO,BANANA NANICA,MARACUJÁ,PÃO E CAFÉ,
2014-06-16,ARROZ E FEIJÃO,BIFE ACEBOLADO,POLENTA AO SUGO,ALFACE/VINAGRETE,MELANCIA,CAJU,PÃO E CAFÉ,
2014-06-18,ARROZ E FEIJÃO,ISCA DE CARNE COM AZEITONA,PURÊ DE BATATA,ESCAROLA/OVO/VINAGRETE,TANGERINA,ABACAXI,PÃO E CAFÉ,
2014-06-25,ARROZ E FEIJÃO,ROLÊ DE CARNE AO MOLHO DE MANJERICÃO,POLENTA CREMOSA,ALFACE,GOIABADA,LARANJA,PÃO E CAFÉ,
2014-06-26,ARROZ E FEIJÃO,FRANGO FRITO,CREME DE MILHO,AGRIÃO/ALFACE COM MAÇÃ,MAÇÃ,MANGA,PÃO E CAFÉ,
2014-06-27,ARROZ E FEIJÃO,FEIJOADA,COUVE REFOGADA,VINAGRETE,LARANJA PERA,CAJU,PÃO E CAFÉ,
2014-06-30,ARROZ E FEIJÃO,LINGUIÇA DE FRANGO,CHUCHU REFOGADO COM BACON,ALFACE,BANANADA,Maracujá,PÃO E CAFÉ,
2014-07-01,ARROZ E FEIJÃO,BIFE À MILANESA,BERINJELA AO SUGO,BETERRABA RALADA / ESCAROLA,MAÇÃ,CAJU,PÃO E CAFÉ,
2014-07-02,ARROZ E FEIJÃO,FRANGO COM PALMITO E BACON,FAROFA DE FRUTAS,ALFACE / RABANETE,TANGERINA PONKAN,ABACAXI,PÃO E CAFÉ,
2014-07-03,ARROZ E FEIJÃO,COZIDO MISTO COM BATATA DOCE,--------,CENOURA RALADA COM ERVILHA E PALMITO/AGRIÃO COM RABANETE,MAÇÃ,LARANJA,PÃO E CAFÉ,
2014-07-07,ARROZ E FEIJÃO,CARNE EM CUBOS COM AZEITONA,POLENTA CREMOSA,ALFACE,NÃO DEFINIDA,MANGA,PÃO E CAFÉ,
2014-07-10,ARROZ E FEIJÃO,NUGGTES,CREME DE ESPINAFRE,BETERRABA RALADA/COUVE FLOR E BROCOLIS/ALFACE,LARANJA PERA,ABACAXI,PÃO E CAFÉ,
2014-07-11,ARROZ E FEIJÃO,BIFE ACEBOLADO COM MOLHO MADEIRA,PURÊ DE BATATA,ESCAROLA/TOMATE,ABACAXÍ,LARANJA,PÃO E CAFÉ,
2014-07-14,ARROZ E FEIJÃO,ESCONDIDINHO DE CARNE MOÍDA,VAGEM REFOGADA,ALFACE/CENOURA COM MILHO VERDE,BANANA NANICA,MANGA,PÃO E CAFÉ,
2014-07-15,ARROZ E FEIJÃO,LAGARTO AO MOLHO DE ABACAXI,REFOGADO DE ESPINAFRE E CENOURA,AGRIÃO / RÚCULA,MAÇÃ,CAJÚ,PÃO E CAFÉ,
2014-07-16,ARROZ E FEIJÃO,FRANGO CREMOSO COM ERVILHA,ESCAROLA REFOGADA,ALFACE/CHUCHU,PUDIM DE COCO COM CALDA DE CARAMELO,ABACAXÍ,PÃO E CAFÉ,
2014-07-18,ARROZ E FEIJÃO,PERNIL AO MOLHO,ABÓBORA REFOGADA,SALADA DE ESCAROLA COM TOMATE / ALFACE,LARANJA PERA,TANGERINA,PÃO E CAFÉ,
2014-07-22,ARROZ E FEIJÃO,Fricassê de frango,Chuchu refogado,Escarola / tomate,Maçã,Cajú,PÃO E CAFÉ,
2014-07-23,ARROZ E FEIJÃO,BIFE ACEBOLADO,COUVE FLOR AO MOLHO BRANCO E QUEIJO,AGRIÃO COM CENOURA E BETERRABA RALADA,SAGU,LARANJA,PÃO E CAFÉ,
2014-07-24,ARROZ E FEIJÃO,STROGONOFF DE CARNE,BATATA FRITA,"MISTA(escarola,pepino,tomate,rabanete e couve-flor)",MELANCIA,ABACAXÍ,PÃO E CAFÉ,
2014-07-25,ARROZ E FEIJÃO,FEIJOADA,COUVE REFOGADA / FAROFA,VINAGRETE,TANGERINA PONKAN,UVA,PÃO E CAFÉ,
2014-07-29,ARROZ E FEIJÃO,FRANGO AO MOLHO,ABOBRINHA REFOGADA,BETERRABA COZIDA/RÚCULA,MAÇÃ,UVA,PÃO E CAFÉ,
2014-07-30,ARROZ E FEIJÃO,CARNE EM CUBOS COM ERVILHA,CENOURA COM MANDIOQUINHA SAUTÉ,COUVE COM CEBOLA,BANANA CARAMELADA,TANGERINA,PÃO E CAFÉ,
2014-08-01,ARROZ E FEIJÃO,LAGARTO COM MOLHO DE ABACAXI,COUVE REFOGADA,TOMATE EM RODELAS/TABULE,LARANJA PONKAN,UVA,PÃO E CAFÉ,
2014-08-04,ARROZ E FEIJÃO,CARNE EM CUBOS COM MANDIOQUINHA,-----,CHUCHU/CEBOLA/ALFACE,GOIABADA,LARANJA,PÃO E CAFÉ,
2014-08-05,ARROZ E FEIJÃO,LAGARTO,POLENTA AO SUGO,BETERRABA COZIDA COM ERVILHA / MISTA VERDE COM REPOLHO ROXO,IOGURTE,CAJU,PÃO E CAFÉ,
2014-08-06,ARROZ E FEIJÃO,BIFE AO BACON,ABÓBORA REFOGADA,ACELGA,BANANA CARAMELADA (substituido por goiabada),ABACAXÍ,PÃO E CAFÉ,"Devido a quebra de equipamento, a sobremesa teve que ser substituida."
2014-08-07,ARROZ E FEIJÃO,ROLÊ DE CARNE,FAROFA,CENOURA COM MAÇÃ,ARROZ DOCE,TANGERINA,PÃO E CAFÉ,
2014-08-11,ARROZ E FEIJÃO,Fricasse de frango,-----,Rúcula com tomate em rodelas/Vinagrete,Macã,Laranja,PÃO E CAFÉ,
2014-08-12,ARROZ E FEIJÃO,BIFE ACEBOLADO,ABOBRINHA REFOGADA,REPOLHO ROXO/ALFACE/OVO COM VINAGRETE,GELATINA DE MORANGO,CAJÚ,PÃO E CAFÉ,SOPA (CANJA)
2014-08-13,ARROZ E FEIJÃO,LINGUIÇA FRITA,REPOLHO REFOGADO,ALFACE COM VINAGRETE,DOCE DE BANANA,TANGERINA,PÃO E CAFÉ,
2014-08-14,ARROZ E FEIJÃO,FRANGO AO MOLHO DE ERVILHA,MANDIOCA FRITA,ESCAROLA COM CENOURA,MELANCIA,UVA,PÃO E CAFÉ,
2014-08-15,ARROZ E FEIJÃO,LAGARTO AO MOLHO MADEIRA,FAROFA,COUVE COM VINAGRETE,BANANA,MANGA,PÃO E CAFÉ,
2014-08-18,ARROZ E FEIJÃO,Salsicha ao sugo,Purê de batata,Acelga/vinagrete,Maçã,Abacaxi,PÃO E CAFÉ,
2014-08-19,ARROZ E FEIJÃO,BIFE AO MOLHO CURRY,-----,ABOBRINHA COZIDA/TOMATE COM CEBOLAS EM CUBOS,PUDIM DE CHOCOLATE,LARANJA,PÃO E CAFÉ,
2014-08-20,ARROZ E FEIJÃO,NUGGETS,MACARRÃO AO SUGO COM PRESUNTO,AGRIÃO/ACELGA/VINAGRTE,MELANCIA,CAJÚ,PÃO E CAFÉ,
2014-08-21,ARROZ E FEIJÃO,CARNE FATIADA COM MOLHO EAZEITONA,POLENTA AO SUGO,ALFACE/RÚCULA,BANANADA,TANGERINA,PÃO E CAFÉ,
2014-08-22,ARROZ E FEIJÃO,Carne picada com mandioquinha,Couve refogada,Alface/vinagrete,Tangerina ponkan,Suco uva,PÃO E CAFÉ,
2014-08-25,ARROZ E FEIJÃO,BIFE AO MOLHO,BERINJELA AO SUGO COM AZEITONA,ALMEIRÃO COM ABACAXÍ/ALFACE,MELANCIA,LARANJA,PÃO E CAFÉ,
2014-08-26,ARROZ E FEIJÃO,Frango frito,Nhoque ao sugo com queijo gorgonzola e parmesão,Alface com cenoura/vinagrete,Bananada,Abacaxi,PÃO E CAFÉ,
2014-08-27,ARROZ E FEIJÃO,BIFE COM AZEITONAS,"FAROFA COM LAGARTO DESFIADO, TOMATE E CEBOLA",ACELGA E AGRIÃO,COCADA BRANCA,UVA,PÃO E CAFÉ,"1.Devido a problemas no fornecimento de carne, o strogonoff foi transferido para o almoço de amanhã. 2. Abastecimento de arroz integral normalizado a partir de hoje (almoço)."
2014-08-28,ARROZ E FEIJÃO,STROGONOFF DE CARNE,BATATA SAUTÊ,REPOLHO COM CENOURA RALADA E SALSÃO/BERINJELA CURTIDA,SAGÚ DE ABACAXI,TANGERINA,PÃO E CAFÉ,
2014-08-29,ARROZ E FEIJÃO,SALSICHA ACEBOLADA,CAPELETTI AO MOLHO BRANCO,PEPINO COM VINAGRETE/REPOLHO COM AGRIÃO/BERINJELA,MAÇÃ/ SAGÚ COM ABACAXI,MANGA,PÃO E CAFÉ,
2014-09-01,ARROZ E FEIJÃO,LINGUIÇA DE FRANGO FRITA,ABÓBORA REFOGADA,ALFACE/BETERRABA RALADA/PEPINO EM CONSERVA,LARANJA PERA,UVA,PÃO E CAFÉ,
2014-09-03,ARROZ E FEIJÃO,Bife ao molho de ervilha,BATATA DOCE NA MANTEIGA,ESCAROLA COM CENOURA RALADA,PUDIM PRESTÍGIO,MARACUJÁ,PÃO E CAFÉ,
2014-09-04,ARROZ E FEIJÃO,FRANGO FRITO,ABOBRINHA REFOGADA,ALMEIRÃO/REPOLHO ROXO,MELANCIA,MANGA,PÃO E CAFÉ,Ocorreu alteração do prato principal devido a não entrega de produto (linguiça)pelo fornecedor.
2014-09-08,ARROZ E FEIJÃO,ISCA DE CARNE A CHINESA,BROCOLIS/CENOURA EM RODELAS E COUVE FLOR,AGRIÃO COM VINAGRETE,lARANJA,UVA,PÃO E CAFÉ,
2014-09-09,ARROZ E FEIJÃO,CARNE EM CUBOS ACEBOLADA,CREME DE MILHO,ESCAROLA COM VINAGRETE/ABOBORA,IOGURTE,LARANJA,PÃO E CAFÉ,
2014-09-10,ARROZ E FEIJÃO,CARNE FATIADA AO MOLHO MADEIRA,NHOQUE AO SUGO,ALFACE/VINAGRETE,MAÇÃ,MARACUJÁ,PÃO E CAFÉ,
2014-09-11,ARROZ E FEIJÃO,ISCA DE CARNE ACEBOLADA,ABOBRINHA REFOGADA/COUVE REFOGADA,ALFACE COM MAÇÃ/AGRIÃO COM VINAGRETE,BANANA,MANGA,PÃO E CAFÉ,
2014-09-16,ARROZ E FEIJÃO,BIFE ACEBOLADO,ESPINAFRE REFOGADO,RÚCULA COM VINAGRETE/SELETA DE LEGUMES,COCADA,TANGERINA,PÃO E CAFÉ,
2014-09-17,ARROZ E FEIJÃO,FRANGO AO MOLHO DE ERVILHA,NHOQUE AO SUGO,ALFACE / ABOBRINHA RALADA,BANANA NANICA,CAJU,PÃO E CAFÉ,
2014-09-18,ARROZ E FEIJÃO,BIFE Á ROLÊ AO MOLHO DE MANJERICÃO,MACARRÃO ALHO E OLEO COM BROCOLIS,ESCAROLA/VINAGRETE,LARANJA,MANGA,PÃO E CAFÉ,
2014-09-19,ARROZ E FEIJÃO,LAGARTO AO MOLHO MADEIRA,FAROFA,COUVE/CHUCHU COZIDO COM VINAGRETE,Bananada,LARANJA,PÃO E CAFÉ,
2014-09-22,ARROZ E FEIJÃO,BIFE AO MOLHO,CAPELETTI AO SUGO,REPOLHO ROXO/BATATA COM TOMATE/VINAGRETE,IOGURTE,MARACUJÁ,PÃO E CAFÉ,
2014-09-23,ARROZ E FEIJÃO,ESCONDIDINHO DE CARNE,---,ALMEIRÃO COM CENOURA E VINAGRETE,LARANJA,UVA,PÃO E CAFÉ,
2014-09-24,ARROZ E FEIJÃO,CARNE FATIADA COM MOLHO EAZEITONA,POLENTA,ALFACE/PEPINO COM VINAGRETE,GELATINA DE LIMÃO,MANGA,PÃO E CAFÉ,
2014-09-25,ARROZ E FEIJÃO,ALMONDEGAS FRITA,ABOBÓRA REFOGADA,REPOLHO /BETERRABA,BANANA,ABACAXI,PÃO E CAFÉ,
2014-09-26,ARROZ E FEIJÃO,Sobrecoxa de frango ao molho com palmito,---,Alface/Batata/Batata com ovo,Gelatina de limão ou Maçã,Manga,PÃO E CAFÉ,
2014-09-29,ARROZ E FEIJÃO,Carne picada com vagem,---,Escarola com cenoura /Escarola com cenoura e vagem,Bananada,Maracujá,PÃO E CAFÉ,
2014-09-30,ARROZ E FEIJÃO,Quibe frito,Polenta ao sugo,Folhas/batata com tomate,LARANJA PERA,Cajú,PÃO E CAFÉ,
2014-10-01,ARROZ E FEIJÃO,ROLÊ DE CARNE,FAROFA DE FRUTAS,ALMEIRÃO/VINAGRETE,MAÇÃ,LARANJA,PÃO E CAFÉ,
2014-10-02,ARROZ E FEIJÃO,STROGONOFF DE CARNE,BATATA SAUTÊ,ACELGA/CENOURA RALADA/CEBOLA/VINAGRETE,GOIABINHA,ABACAXI,PÃO E CAFÉ,
2014-10-03,ARROZ E FEIJÃO,BIFE ACEBOLADO,ABOBRINHA REFOGADA,ESCAROLA/BETERRABA/ALMEIRÃO/VINAGRETE,LARANJA,UVA,PÃO E CAFÉ,
2014-10-06,ARROZ E FEIJÃO,ISCA DE CARNE COM ERVILHA E PIMENTÃO VERMELHO,COUVE FLOR COM BRÓCOLIS,REPOLHO BICOLOR/VINAGRETE,BANANA NANICA,LIMÃO,PÃO E CAFÉ,
2014-10-07,ARROZ E FEIJÃO,BIFE COM BACON,BERINJELA NAPOLITANA,ALFACE/AGRIÃO COM VINAGRETE,MELANCIA,MARACUJÁ,PÃO E CAFÉ,
2014-10-08,ARROZ E FEIJÃO,COZIDO Á PORTUGUESA,---,ALFACE COM RÚCULA E CEBOLA/PEPINO COM VINAGRETE,MAÇÃ,ABACAXI,PÃO E CAFÉ,
2014-10-09,ARROZ E FEIJÃO,kibe frito,Abóbora japonesa refogada,Acelga/beterraba ralada,Sagú,Tangerina,PÃO E CAFÉ,
2014-10-10,ARROZ E FEIJÃO,CARNE COM CEBOLA E AZEITONA,BATATA DOCE FRITA,PEPINO COM VINAGRETE/RUCULA/ALFACE COM ABACAXI,LARANJA,CAJÚ,PÃO E CAFÉ,
2014-10-13,ARROZ E FEIJÃO,ALMONDEGAS FRITA,MACARRÃO AO SUGO,AGRIÃO COM VINAGRETE/ABOBRINHA RALADA,MELANCIA,LARANJA,PÃO E CAFÉ,
2014-10-14,ARROZ E FEIJÃO,FRANGO AO MOLHO,LEGUMES REFOGADOS(MANDIOQUINHA/BATATA),ESCAROLA COM VINAGRETE/VAGEM,IOGURTE,TANGERINA,PÃO E CAFÉ,
2014-10-15,ARROZ E FEIJÃO,BIFE CALIFORNIA,CHUCHU REFOGADO,COUVE/BETERRABA,BANANA,CAJÚ,PÃO E CAFÉ,
2014-10-16,ARROZ E FEIJÃO,ESCONDIDINHO DE CARNE SECA,ESCAROLA REFOGADA,ALMEIRÃO COM VINAGRETE,TANGERINA,ABACAXI,PÃO E CAFÉ,
2014-10-17,ARROZ E FEIJÃO,ISCA DE FRANGO ACEBOLADA COM PALMITO,ESCAROLA REFOGADA,MISTA VERDE /REPOLHO ROXO COM RABANETE,MELANCIA OU DOCE DE BANANA,TANGERINA,PÃO E CAFÉ,
2014-10-20,ARROZ E FEIJÃO,BIFE AO MOLHO,LEGUMES SAUTÊ,ALMEIRÃO COM VINAGRETE,MAÇÃ,CAJÚ,PÃO E CAFÉ,
2014-10-21,ARROZ E FEIJÃO,CARNE EM CUBOS COM BATATA,--,BETERRABA COM VINAGRETE/AGRIÃO COM ALMEIRÃO/RABANETE COM CENOURA,MELANCIA,TANGERINA,PÃO E CAFÉ,
2014-10-22,ARROZ E FEIJÃO,FRANGO FRITO,MACARRÃO AO SUGO,ALFACE/AGRIÂO/ACELGA/VINAGRETE,LARANJA,UVA,PÃO E CAFÉ,
2014-10-23,ARROZ E FEIJÃO,BIFE Á ROLÊ,ESPINAFRE REFOGADO,ESCAROLA COM CEBOLA/AGRIÃO COM VINAGRETE/VAGEM,BANANA,MANGA,PÃO E CAFÉ,
2014-10-24,ARROZ E FEIJÃO,ISCA DE FRANGO CREMOSA COM MILHO,CHUCHU REFOGADO,ALFACE/AGRIÃO COM VINAGRETE/ACELGA COM VINAGRETE,GELATINA DE MORANGO,LIMÃO,PÃO E CAFÉ,
2014-10-27,ARROZ E FEIJÃO,"PALETA EM CUBOS COM LEGUMES(pimentão vermelho,brocolis/vagem e cebola)",---,ESCAROLA/ESPINAFRE COM VINAGRETE,MAÇÃ,LARANJA,PÃO E CAFÉ,
2014-10-28,ARROZ E FEIJÃO,BIFE Á PIZZAIOLO,VAGEM REFOGADA,ACELGA COM ABACAXI/ACELGA COM VINAGRETE,GOIABADA,ABACAXI,PÃO E CAFÉ,
2014-10-29,ARROZ E FEIJÃO,KIBE FRITO,ABOBRINHA REFOGADA,REPOLHO /TABULE,BANANA,CAJÚ,PÃO E CAFÉ,
2014-10-30,ARROZ E FEIJÃO,Carne em cubos acebolada,Polenta ao sugo,Alface com cenoura raladaa,Sagú,manga,PÃO E CAFÉ,
2014-10-31,ARROZ E FEIJÃO,LAGARTO AO MOLHO MADEIRA,CHUCHU REFOGADO,ESCAROLA COM VINAGRETE/ALFACE COM CENOURA,MAÇÃ,MARACUJÁ,PÃO E CAFÉ,
2014-11-03,ARROZ E FEIJÃO,ALMONDEGAS FRITA,MACARRÃO COM ALHO E ERVAS,ALFACE/ALFACE COM VINAGRETE,BANANADA,ABACAXI,PÃO E CAFÉ,
2014-11-04,ARROZ E FEIJÃO,ESCONDIDINHO DE CARNE SECA,ESCAROLA REFOGADA,ACELGA COM MAÇÃ/ACELGA COM VINAGRETE,MAÇÃ,TANGERINA,PÃO E CAFÉ,
2014-11-05,ARROZ E FEIJÃO,BIFE ACEBOLADO,CENOURA SAUTÊ COM SALSÃO,ALFACE COM ESCAROLA/BETERRABA RALADA,GELATINA DE LIMÃO,CAJÚ,PÃO E CAFÉ,
2014-11-06,ARROZ E FEIJÃO,BIFE Á ROLÊ,FAROFA COM OVOS E PASSAS,REPOLHO COM CENOURA RALADA/PICLES,BANANA,MARACUJÁ,PÃO E CAFÉ,
2014-11-07,ARROZ E FEIJÃO,FRANGO FRITO,CHUCHU REFOGADO,ALFACE COM VINAGRETE,TANGERINA,UVA,PÃO E CAFÉ,
2014-11-10,ARROZ E FEIJÃO,BIFE Á PIZZAIOLO,REPOLHO REFOGADO,ALFACE COM ALMEIRÃO/BATATA COM OVOS,BANANA,LARANJA,PÃO E CAFÉ,
2014-11-11,ARROZ E FEIJÃO,CARNE EM CUBOS COM PALMITO,FAROFA DE FRUTAS,ALFACE,MELANCIA,MARACUJÁ,PÃO E CAFÉ,
2014-11-12,ARROZ E FEIJÃO,LAGARTO AO MOLHO MADEIRA,ABOBRINHA REFOGADA,ALFACE CRESPA/CENOURA RODELA,MAÇÃ,MANGA,PÃO E CAFÉ,
2014-11-13,ARROZ E FEIJÃO,OVOS MEXIDOS COM ERVILHA E VINAGRETE,BERINJELA REFOGADA,REPOLHO COM VINAGRETE/CHUCHU COZIDO,GOIABADA,ABACAXI,PÃO E CAFÉ,
