Data,Acompanhamentos,Prato Principal,Guarnição,Salada,Sobremesa,Refresco,Extra,Nota Técnica
2023-02-28,ARROZ E FEIJÃO,Peixe ao molho de limão,Escarola refogada,Beterraba ralada,Maçã,Acerola,PÃO E CAFÉ,Contém glúten no pão. Não contém ovos e lactose.
2023-03-01,ARROZ E FEIJÃO,Frango assado,Quibebe,Repolho bicolor,Banana,Uva,PÃO E CAFÉ,Contém glúten no pão. Não contém ovos e lactose.
2023-03-02,ARROZ E FEIJÃO,Bisteca suina ao molho especial agridoce,Abobrinha refogada,"Multicolor (batata, beterraba e milho)",Laranja,Acerola,PÃO E CAFÉ,Contém glúten no pão. Não contém ovos e lactose.
2023-03-03,ARROZ E FEIJÃO,Almondegas ao molho de tomate,Macarrão alho e óleo,Alface,Maçã,Manga,PÃO E CAFÉ,"Contém glúten no pão, no macarrão e na almondega. Não contém ovos e lactose."
2023-03-06,ARROZ E FEIJÃO,"Carne picada a chinesa (cenoura, brócolis e couve flor)",Escarola refogada,Tabule,Laranja,Morango,PÃO E CAFÉ,"Contém glúten no pão, na carne e no tabule. Não contém ovos e lactose."
2023-03-07,ARROZ E FEIJÃO,Sobrecoxa ao molho com quiabo,Abobrinha Aromática,Beterraba ralada,Bolinho de chocolate,Limão,PÃO E CAFÉ,"Contém glúten no pão, no bolinho de chocolate e no molho da sobrecoxa. Contém ovos e lactose no bolinho de chocolate."
2023-03-08,ARROZ E FEIJÃO,Carne assada a Lessa,Repolho refogado,"Italiana (tomate, cebola e azeitona preta e pepino)",Maçã,Laranja,PÃO E CAFÉ,Contém glúten no pão. Não contém ovos e lactose.
2023-03-09,ARROZ E FEIJÃO,"Peixe à escabeche (filé, azeitona verde, tomate, batata rodela e molho shoyu)",Pirão,Cenoura cozida,Laranja,Acerola,PÃO E CAFÉ,Contém glúten no pão e no peixe à escabeche. Não contém ovos e lactose.
2023-03-10,ARROZ E FEIJÃO,Sassami de frango ao sugo,"Legumes refogados (brócolis, cenoura e chuchu)",Escarola,Maçã,Maracujá,PÃO E CAFÉ,Contém glúten no pão. Não contém ovos e lactose.
2023-03-13,ARROZ E FEIJÃO,Bife à pizzaiolo,"Arroz colorido (cenoura em cubos, arroz, milho e ervilha em conserva e açafrão)",Salada de acelga,Banana,Maracujá,PÃO E CAFÉ,Contém glúten no pão. Contém derivados de ovos e leite no molho da salada.
2023-03-14,ARROZ E FEIJÃO,Toscana Acebolada,Repolho refogado,Pepino,Maçã,Limão,PÃO E CAFÉ,Contém glúten no pão. Não contém ovos e lactose.
2023-03-15,ARROZ E FEIJÃO,Frango assado (sobrecoxa),Virado de abobrinha,Mix de repolho,Goiabada,Laranja,PÃO E CAFÉ,Contém glúten no pão e no frango assado. Não contém ovos e lactose.
2023-03-16,ARROZ E FEIJÃO,Cubos bovinos com azeitona e cenoura,Purê de batata,Almeirão com tomate,Barra de cereal,Acerola,PÃO E CAFÉ,"Contém glúten no pão, no purê e na barra de cereal. Contém ovos no purê. Pode conter ovos e lactose no molho de vinagrete."
2023-03-17,ARROZ E FEIJÃO,Filé de frango a pomodoro,Polenta cremosa,Cenoura ralada,Maçã,Abacaxi,PÃO E CAFÉ,"Contém glúten no pão e no frango. Pode conter leite, ovos e derivados no tempero vinagrete"
2023-03-20,ARROZ E FEIJÃO,Bife de copa lombo acebolado,Abobrinha refogada,Alface,Banana,Maracujá,PÃO E CAFÉ,"Contém glúten no pão. Não contém ovos e lactose. Pode conter ovos, leite e derivados no molho vinagrete."
2023-03-21,ARROZ E FEIJÃO,Peixe à portuguesa,Acelga refogada,Escarola com tomate,Maçã,Laranja,PÃO E CAFÉ,Contém glúten no pão. Não contém ovos e lactose.
2023-03-22,ARROZ E FEIJÃO,Carne moída com legumes (chuchu com vagem),Macarrão ao sugo,Cenoura ralada,Laranja,Pêssego,PÃO E CAFÉ,"Contém glúten no pão e no macarrão. Pode conter ovos no macarrão ao sugo. Pode conter ovo, leite e derivados no molho vinagrete ""Bom Sabor""."
2023-03-23,ARROZ E FEIJÃO,Bife a pomodoro,Purê de batata,Pepino com tomate e cebola,Maçã,Maracujá,PÃO E CAFÉ,"Contém glúten no pão e no molho do bife a pomodoro. Contém lactose no purê de batata. Pode conter ovo, leite e derivados no molho vinagrete ""Bom Sabor""."
2023-03-24,ARROZ E FEIJÃO,Lagarto assado,Abobrinha refogada,"Mix de folhas (alface, acelga)",Laranja,Acerola,PÃO E CAFÉ,"Contém glúten no pão e no prato principal ""lagarto assado"". Pode conter ovo, leite e derivados no molho vinagrete ""Bom Sabor""."
2023-03-27,ARROZ E FEIJÃO,Strogonoff de carne,Batata Palha,Almeirão com anéis de cebola,Banana,Uva,PÃO E CAFÉ,"Contém glúten no pão e no Strogonoff. Contém lactose no strogonoff. Pode conter ovo, leite e derivados no molho vinagrete ""Bom Sabor""."
2023-03-28,ARROZ E FEIJÃO,Guisadinho de batata doce (acém em cubos),Escarola refogada,Alface com tomate,Maçã,Laranja,PÃO E CAFÉ,"Contém glúten no pão e no molho da carne. Pode conter ovo, leite e derivados no molho vinagrete ""Bom Sabor""."
2023-03-29,ARROZ E FEIJÃO,Sobrecoxa à caçadora,Virado de banana,Acelga,Laranja,Maracujá,PÃO E CAFÉ,"Contém glúten no pão. Pode conter ovo, leite e derivados no molho vinagrete ""Bom Sabor""."
2023-03-30,ARROZ E FEIJÃO,Isca de frango cremosa,Seleta de legumes (cenoura e chuchu),Chicória,Maçã,Pêssego,PÃO E CAFÉ,"Contém glúten no pão e na isca de frango cremosa. Pode conter ovo, leite e derivados no molho vinagrete ""Bom Sabor""."
2023-03-31,ARROZ E FEIJÃO,"Entreveiro brasileiro (paleta em cubos bovino e suíno, calabresa)",Mandioca refogada,Alface,Banana,Laranja,PÃO E CAFÉ,"Contém glúten no pão e no entreveiro brasileiro. Pode conter ovo, leite e derivados no molho vinagrete ""Bom Sabor""."
2023-04-03,ARROZ E FEIJÃO,Bife à pomodoro - alterado para Calabresa acebolada,Macarrão ao sugo,Repolho liso - alterado para almeirão,Bolinho de chocolate,Uva,PÃO E CAFÉ,"Contém glúten no pão, no bife à pomodoro, macarrão e no bolinho de chocolate. Pode conter ovo, leite e derivados no molho vinagrete ""Bom Sabor"""
2023-04-04,ARROZ E FEIJÃO,Sobrecoxa ao molho de tomate,Cenoura refogada,Pepino,Maçã,Laranja,PÃO E CAFÉ,"Contém glúten no pão e na sobrecoxa ao molho de tomate. Pode conter ovo, leite e derivados no molho vinagrete ""Bom Sabor"""
2023-04-05,ARROZ E FEIJÃO,Bisteca ao molho de limão,Batata doce refogada,Almeirão,Laranja,Manga,PÃO E CAFÉ,"Contém glúten no pão e na bisteca ao molho de limão. Pode conter ovo, leite e derivados no molho vinagrete ""Bom Sabor"""
2023-04-10,ARROZ E FEIJÃO,Cubos de frango à chinesa (couve flor e cenoura),Acelga refogada,Alface,Barra de cereal,Pêssego,PÃO E CAFÉ,"Contém glúten no pão e na barra de cereal. Contém lactose na barra de cereal. Pode conter ovo, leite e derivados no molho vinagrete ""Bom Sabor"""
2023-04-11,ARROZ E FEIJÃO,Carne em cubos com batata,"Cuscuz de legumes (ovo, ervilha, cenoura e abobrinha)",Almeirão com azeitonas pretas,Laranja,Maracujá,PÃO E CAFÉ,"Contém glúten no pão e no molho da carne. Contém ovo no cuscuz de legumes. Pode conter ovo, leite e derivados no molho vinagrete ""Bom Sabor"""
2023-04-12,ARROZ E FEIJÃO,Carne assada,Repolho refogado,Couve,Banana,Limão,PÃO E CAFÉ,"Contém glúten no pão. Pode conter ovo, leite e derivados no molho vinagrete ""Bom Sabor"""
2023-04-13,ARROZ E FEIJÃO,Filé de merluza ao molho de espinafre,Chuchu refogado,Alface crespa com nabo,Maçã,Uva,PÃO E CAFÉ,"Contém glúten no pão e no molho do peixe. Pode conter ovo, leite e derivados no molho vinagrete ""Bom Sabor"""
2023-04-14,ARROZ E FEIJÃO,Feijoada,Couve refogada,Vinagrete,Laranja,Acerola,PÃO E CAFÉ,"Contém glúten no pão. Pode conter ovo, leite e derivados no molho vinagrete ""Bom Sabor"""
2023-04-17,ARROZ E FEIJÃO,Sassami ao sugo,Polenta cremosa,Alface crespa,Doce de leite,Maracujá,PÃO E CAFÉ,"Contém glúten no pão e no molho do frango. Não contém ovos. Contém lactose no doce de leite. Pode conter ovo, leite e derivados no molho vinagrete ""Bom Sabor"""
2023-04-18,ARROZ E FEIJÃO,Strogonoff de carne,Batata palha,Acelga,Maçã,Goiaba,PÃO E CAFÉ,"Contém glúten no pão e no strogonoff de carne. Contém lactose no strogonoff de carne. Pode conter ovo, leite e derivados no molho vinagrete ""Bom Sabor""."
2023-04-19,ARROZ E FEIJÃO,Linguiça toscana acebolada,Abobrinha refogada,Escarola,Laranja,Uva,PÃO E CAFÉ,"Contém glúten no pão. Pode conter ovo, leite e derivados no molho vinagrete ""Bom Sabor"""
2023-04-20,ARROZ E FEIJÃO,Lagarto com alho poró,Couve refogado,Pepino,Curau com canela,Pessêgo,PÃO E CAFÉ,"Contém glúten no lagarto, isca de frango, pão e curau. Curau com canela"
2023-04-24,ARROZ E FEIJÃO,Peixe ao molho de hortelã,Batata sautee,Caponata de Berinjela,Laranja,Acerola,PÃO E CAFÉ,"Contém glúten no pão e no molho do peixe. Pode conter ovo, leite e derivados no molho vinagrete ""Bom Sabor"""
2023-04-25,ARROZ E FEIJÃO,Quibe ao molho de limão,Legumes refogados (cenoura e couve-flor),Alface crespa,Maçã,Manga,PÃO E CAFÉ,"Contém glúten no quibe, no pão e no molho de limão. Não contém ovos e lactose. Pode conter ovo, leite e derivados no molho vinagrete ""Bom Sabor"""
2023-04-26,ARROZ E FEIJÃO,Carne em cubos nutritiva (batata doce e cenoura),Acelga refogada,Almeirão,Laranja,Morango,PÃO E CAFÉ,"Contém glúten no pão e na carne em cubos nutritiva. Não contém ovos e lactose. Pode conter ovo, leite e derivados no molho vinagrete ""Bom Sabor"""
2023-04-27,ARROZ E FEIJÃO,Bife ao molho de mostarda,Purê de batata,Repolho bicolor,Maçã,Goiaba,PÃO E CAFÉ,"Contém glúten no pão e no molho da carne. Contém lactose no purê de batata. Pode conter ovo, leite e derivados no molho vinagrete ""Bom Sabor"""
2023-04-28,ARROZ E FEIJÃO,Sobrecoxa ao molho de gengibre,Chuchu sautee,Escarola,Goiabada,Caju,PÃO E CAFÉ,"Contém glúten no pão e no frango. Não contém ovos e lactose. Pode conter ovo, leite e derivados no molho vinagrete ""Bom Sabor"""
2023-05-02,ARROZ E FEIJÃO,Bife de patinho acebolado,Couve refogada,Alface com tomate,Maçã,Acerola,PÃO E CAFÉ,"Contém glúten no pão. Pode conter ovo, leite e derivados no molho para salada ""Bom Sabor""."
2023-05-03,ARROZ E FEIJÃO,Salsicha ao sugo,Purê de batata,Repolho Bicolor,Laranja,Morango,PÃO E CAFÉ,"Contém glúten na salsicha e no pão. Contém lactose no purê de batata. Pode conter ovo, leite e derivados no molho para salada ""Bom Sabor""."
2023-05-04,ARROZ E FEIJÃO,"Peixe com batata, pimentão, tomate e cebola",Cenoura,Almeirão com cebola,Banana,Pêssego,PÃO E CAFÉ,"Contém glúten no pão e no prato principal. Pode conter ovo, leite e derivados no molho para salada ""Bom Sabor""."
2023-05-05,ARROZ E FEIJÃO,Sobrecoxa ao molho de quiabo,Polenta cremosa,Acelga com rabanete,Maçã,Abacaxi,PÃO E CAFÉ,"Contém glúten na sobrecoxa e no pão. Pode conter ovo, leite e derivados no molho para salada ""Bom Sabor""."
2023-05-08,ARROZ E FEIJÃO,Cubos suínos ao molho barbecue,Farofa de banana,Alface,Maça,Maracujá,PÃO E CAFÉ,"Contém glúten no pão e prato principal. Pode conter ovo, leite e derivados no molho para salada ""Bom Sabor""."
2023-05-09,ARROZ E FEIJÃO,Strogonoff de carne,Batata palha,Escarola com abacaxi,Laranja,Uva,PÃO E CAFÉ,"Contém glúten no pão e strogonoff. Contém lactose no strogonoff. Pode conter ovo, leite e derivados no molho para salada ""Bom Sabor""."
2023-05-10,ARROZ E FEIJÃO,Iscas de frango ao molho de queijo,Batata sauté,Acelga,Banana,Morango,PÃO E CAFÉ,"Contém glúten no pão e prato principal. Contém lactose no prato principal. Pode conter ovo, leite e derivados no molho para salada ""Bom Sabor""."
2023-05-11,ARROZ E FEIJÃO,Carne em cubos com mandioca,Almeirão refogado,Berinjela curtida,Arroz doce,Maracujá,PÃO E CAFÉ,"Contém glúten na carne em cubos com mandioca, pão e sobremesa. Contém lactose na sobremesa. Pode conter ovo, leite e derivados no molho para salada ""Bom Sabor""."
2023-05-12,ARROZ E FEIJÃO,Feijoada,Couve refogada,Vinagrete,Laranja,Limão,PÃO E CAFÉ,"Contém glúten no pão e sobremesa. Pode conter ovo, leite e derivados no molho para salada ""Bom Sabor""."
2023-05-15,ARROZ E FEIJÃO,Linguiça de frango acebolada,Abobrinha com ervas,Beterraba ralada,Banana,Laranja,PÃO E CAFÉ,"Contém glúten no pão. Pode conter ovo, leite e derivados no molho para salada ""Bom Sabor""."
2023-05-16,ARROZ E FEIJÃO,Bife de patinho ao molho mostarda,Chuchu refogado,Alface com rabanete ralado,Bolinho de chocolate,Morango,PÃO E CAFÉ,"Contém glúten no pão, bolinho de chocolate e molho do bife. Contém lactose no bife ao molho mostarda. Pode conter ovo e soja no molho de mostarda do bife. Pode conter ovo, leite e derivados no molho para salada ""Bom Sabor""."
2023-05-17,ARROZ E FEIJÃO,Isca de frango ao molho escuro,Batata chips,Almeirão com cenoura ralada,Maçã,Acerola,PÃO E CAFÉ,"Contém glúten no pão e na isca de frango. Pode conter ovo, leite e derivados no molho para salada ""Bom Sabor""."
2023-05-18,ARROZ E FEIJÃO,Moqueca de peixe,Pirão,Acelga,Laranja,Uva,PÃO E CAFÉ,"Contém glúten no pão e na moqueca. Pode conter ovo, leite e derivados no molho para salada ""Bom Sabor""."
2023-05-19,ARROZ E FEIJÃO,Strogonoff de frango,Batata sautée,Pepino,Gelatina de morango,Abacaxi,PÃO E CAFÉ,"Contém glúten no pão, no strogonoff e na gelatina. Contém lactose no strogonoff. Pode conter ovo, leite e derivados no molho para salada ""Bom Sabor""."
2023-05-22,ARROZ E FEIJÃO,Carne em cubos com calabresa e bacon,Repolho com acelga refogados,Escarola,Laranja,Limão,PÃO E CAFÉ,"Contém glúten no pão. Pode conter ovo, leite e derivados no molho para salada ""Bom Sabor""."
2023-05-23,ARROZ E FEIJÃO,Fricassê de frango,Ratatouile,Escarola,Banana,Acerola,PÃO E CAFÉ,"Contém glúten no pão e no fricassê de frango. Contém lactose no fricassê de frango. Pode conter ovo, leite e derivados no molho para salada ""Bom Sabor""."
2023-05-24,ARROZ E FEIJÃO,Iscas de carne ao molho inglês,"Legumes sauteé (chuchu, cenoura e salsa)",Alface com beterraba ralada,Doce de goiaba,Maracujá,PÃO E CAFÉ,"Contém glúten no pão, na iscas de carne e no doce de goiaba. Pode conter ovo, leite e derivados no molho para salada ""Bom Sabor""."
2023-05-25,ARROZ E FEIJÃO,Iscas de frango com abóbora e brócolis,Mix de repolho refogado,Cenoura ralada,Laranja,Morango,PÃO E CAFÉ,"Contém glúten no pão. Pode conter ovo, leite e derivados no molho para salada ""Bom Sabor""."
2023-05-26,ARROZ E FEIJÃO,Carne em cubos,Macarrão parafuso à primavera,Acelga,Banana,Pêssego,PÃO E CAFÉ,"Contém glúten no pão. Pode conter ovo, leite e derivados no molho para salada ""Bom Sabor""."
2023-05-29,ARROZ E FEIJÃO,Frango em cubos ao molho de azeitona,Quibebe de abóbora,Alface,Maçã,Uva,PÃO E CAFÉ,Contém glúten no Frango em cubos e no pão. Não contém ovos e lactose.
2023-05-30,ARROZ E FEIJÃO,Frango ensopado,Virado de couve,Acelga,Banana,Laranja,PÃO E CAFÉ,Contém glúten no frango e no pão. Não contém ovos e lactose.
2023-05-31,ARROZ E FEIJÃO,Cubos suíno acebolado,Berinjela a pomodoro,Almeirão,Goiabada,Cajú,PÃO E CAFÉ,Contém glúten no cubo suíno e no pão. Não contém ovos e lactose.
2023-06-01,ARROZ E FEIJÃO,Bife acebolado,Polenta ao sugo,Alface,Laranja,Laranja,PÃO E CAFÉ,"Contém glúten no pão e no bife. Pode conter ovo, leite e derivados no molho para salada ""Bom Sabor""."
2023-06-02,ARROZ E FEIJÃO,Iscas de frango à chinesa,Batata palha,Almeirão,Banana,Manga,PÃO E CAFÉ,"Contém glúten no pão e no frango. Não contém ovos e lactose. Pode conter ovo, leite e derivados no molho para salada ""Bom Sabor""."
2023-06-05,ARROZ E FEIJÃO,Carne picada com azeitona,Batata chips,Acelga,Maçã,Manga,PÃO E CAFÉ,"Contém glúten no pão, no prato principal e na guarnição. Pode conter ovo, leite e derivados no molho para salada ""Bom Sabor""."
2023-06-06,ARROZ E FEIJÃO,Peixe com batata e vagem,Pirão,Beterraba ralada,Doce de leite,Limão,PÃO E CAFÉ,"Contém glúten no pão e no prato principal. Contém lactose no doce de leite. Pode conter ovo, leite e derivados no molho para salada ""Bom Sabor""."
2023-06-07,ARROZ E FEIJÃO,Sobrecoxa de molho de laranja,Cenoura com chuchu refogados,Pepino,Banana,Acerola,PÃO E CAFÉ,"Contém glúten no pão e prato principal. Pode conter ovo, leite e derivados no molho para salada ""Bom Sabor""."
2023-06-12,ARROZ E FEIJÃO,Bife a pomodoro,Espinafre ao m. de alho,Acelga com laranja,Bolinho de chocolate,Laranja,PÃO E CAFÉ,"Contém glúten no pão, no bolinho de chocolate e no bife à pomodoro. Contém ovos e lactose no bolinho de chocolate."
2023-06-13,ARROZ E FEIJÃO,Strogonofe bovino,Batata Soute,Alface,Maçã,Abacaxi,PÃO E CAFÉ,Contém glúten no pão e no estrogonofe bovino. Não contém ovos. Contém lactose na batata soutê e no estrogonofe bovino.
2023-06-14,ARROZ E FEIJÃO,Carne moída com cenoura e ervilha,Escarola refogada,Tabule,Banana nanica,Maracujá,PÃO E CAFÉ,Contém glúten no pão e no tabule. Não contém ovos e lactose.
2023-06-15,ARROZ E FEIJÃO,Sassami ao vinagrete,Creme de milho,Repolho bicolor,Tangerina,Abacaxi,PÃO E CAFÉ,Contém glúten no pão e na guarnição creme de milho. Não contém ovos. Contém lactose no creme de milho.
2023-06-16,ARROZ E FEIJÃO,Feijoada,Couve refogada,Vinagrete,Laranja,Limão,PÃO E CAFÉ,Contém glúten no pão. Não contém ovos e lactose.
2023-06-19,ARROZ E FEIJÃO,Cubos bovinos com mandioquinha,Brócolis refogado com cenoura,Couve,Barra de cereal,Pêssego,PÃO E CAFÉ,"Contém glúten no pão e no prato principal. Contém lactose na barra de cereal. Pode conter lactose, ovo e soja no molho de cubos bovinos.Pode conter ovo, leite e derivados no molho para salada ""Bom Sabor""."
2023-06-20,ARROZ E FEIJÃO,Bife ao molho argentino,Arroz à grega,Tomate com azeitona preta,Banana,Abacaxi,PÃO E CAFÉ,"Contém glúten no pão. Pode conter ovo, leite e derivados no molho para salada ""Bom Sabor""."
2023-06-21,ARROZ E FEIJÃO,Frango ensopado,Farofa rica,Chuchu com milho,Maçã,Goiaba,PÃO E CAFÉ,"Contém glúten no pão. Pode conter ovo, leite e derivados no molho para salada ""Bom Sabor""."
2023-06-22,ARROZ E FEIJÃO,Lagarto desfiado,"Mix de legumes (Berinjela,abobrinha, tomate e pimentão)",Alface com beterraba,Bolinho de chocolate,Caju,PÃO E CAFÉ,"Contém glúten no Lagarto e no pão. Pode conter ovo, leite e derivados no molho para salada ""Bom Sabor""."
2023-06-23,ARROZ E FEIJÃO,Linguiça toscana,Couve refogada,Grão de bico com atum,Laranja,Morango,PÃO E CAFÉ,"Contém glúten na couve refogada e no pão. Pode conter ovo, leite e derivados no molho para salada ""Bom Sabor""."
2023-06-26,ARROZ E FEIJÃO,Filé de frango acebolado,Creme de espinafre,Caponata de berinjela,Laranja,Abacaxi,PÃO E CAFÉ,"Contém glúten no filé de frango, no creme de espinafre e no pão. Pode conter ovo, leite e derivados no molho para salada ""Bom Sabor""."
2023-06-27,ARROZ E FEIJÃO,Cubos suino ao molho de abacaxi,Virado de escarola,Alface com Agrião,Banana,Manga,PÃO E CAFÉ,"Contém glúten no cubo suíno e no pão. Pode conter ovo, leite e derivados no molho para salada ""Bom Sabor""."
2023-06-28,ARROZ E FEIJÃO,Sobrecoxa assada ao creme de cebola,Chuchu com salsa,Pepino com Tomate,Pudim de coco com calda,Limão,PÃO E CAFÉ,"Contém glúten no frango, no pudim de coco e no pão. Pode conter ovo, leite e derivados no molho para salada ""Bom Sabor"". Contém lactose no pudim de coco com calda."
2023-06-29,ARROZ E FEIJÃO,Copa lombo ao molho agridoce,Berinjela ao forno,Acelga com cebola,Laranja,Acerola,PÃO E CAFÉ,"Contém glúten no pão e na copa lombo ao molho agridoce. Pode conter ovo, leite e derivados no molho para salada ""Bom Sabor""."
2023-06-30,ARROZ E FEIJÃO,Iscas de frango ao molho de mostarda,Macarrão à primavera,Abobrinha com ervilha,Goiabada,Pessego,PÃO E CAFÉ,"Contém glúten no pão, no prato principal e na guarnição. Pode conter ovo, leite e derivados no molho para salada ""Bom Sabor""."
2023-07-03,ARROZ E FEIJÃO,Isca de frango com cebola,Macarrão alho e óleo,Repolho,Bolinho de chocolate,Uva,PÃO E CAFÉ,"Contém glúten no pão, macarrão e no bolinho de baunilha. Contém lactose no bolinho de chocolate. Pode conter ovo, leite e derivados no molho para salada ""Bom Sabor""."
2023-07-04,ARROZ E FEIJÃO,Bife ao molho inglês,Cenoura refogada,Pepino,Banana,Laranja,PÃO E CAFÉ,"Contém glúten no pão, na guarnição e no prato principal. Pode conter lactose, ovo e soja no bife. Pode conter ovo, leite e derivados no molho para salada ""Bom Sabor""."
2023-07-05,ARROZ E FEIJÃO,Bisteca ao molho de limão,Couve refogada,Almeirão,Laranja,Manga,PÃO E CAFÉ,"Contém glúten no pão e no prato principal. Pode conter lactose, ovo e soja na bisteca. Contém glúten na couve refogada. Pode conter ovo, leite e derivados no molho para salada ""Bom Sabor""."
2023-07-06,ARROZ E FEIJÃO,Isca de frango ao Molho de Mostarda,Berinjela refogada,Alface crespa,Banana,Morango,PÃO E CAFÉ,"Contém glúten no pão, no frango assado e na berinjela refogada. Pode conter ovo, leite e derivados no molho para salada ""Bom Sabor""."
2023-07-07,ARROZ E FEIJÃO,Peixe à Escabeche,Chuchu Sautê,Salada mista,Canjica,Goiaba,PÃO E CAFÉ,"Contém glúten no pão e no peixe à escabeche e no chuchu. Contém lactose na canjica. Pode conter lactose, ovo e soja no peixe Pode conter ovo, leite e derivados no molho para salada ""Bom Sabor""."
2023-07-10,ARROZ E FEIJÃO,Filé de pescada com brócolis e couve-flor,Repolho refogado,Rúcula,Banana,Pêssego,PÃO E CAFÉ,"Contém glúten no pão. Contém lactose na barra de cereal. Pode conter ovo, leite e derivados no molho para salada ""Bom Sabor""."
2023-07-11,ARROZ E FEIJÃO,Bife ao molho de champignon,Cenoura refogada,Almeirão com azeitonas pretas,Tangerina,Maracujá,PÃO E CAFÉ,"Contém glúten no pão e no prato principal. Pode conter ovo, leite e derivados no molho para salada ""Bom Sabor""."
2023-07-12,ARROZ E FEIJÃO,Sobrecoxa assada,Repolho refogado,Couve,Banana,Acerola,PÃO E CAFÉ,"Contém glúten no pão e no prato principal. Pode conter ovo, leite e derivados no molho para salada ""Bom Sabor""."
2023-07-13,ARROZ E FEIJÃO,Carne em cubos com batata,Berinjela refogada,Alface crespa com nabo,Goiabada,Uva,PÃO E CAFÉ,"Contém glúten no pão e no prato principal. Pode conter ovo, leite e derivados no molho para salada ""Bom Sabor""."
2023-07-14,ARROZ E FEIJÃO,Feijoada,Virado de couve,Vinagrete quente/almeirão,Laranja,Limão,PÃO E CAFÉ,"Contém glúten no pão. Pode conter ovo, leite e derivados no molho para salada ""Bom Sabor""."
2023-07-17,ARROZ E FEIJÃO,Sassami com brócolis,Creme de milho,Alface crespa,Doce de leite,Goiaba,PÃO E CAFÉ,"Contém glúten no pão, no sassami com brócolis e no creme de milho. Contém lactose no creme de milho e no doce de leite. Pode conter ovo, leite e derivados no molho para salada ""Bom Sabor""."
2023-07-18,ARROZ E FEIJÃO,Strogonoff de carne,Batata palha,Acelga,Maçã,Cajú,PÃO E CAFÉ,"Contém glúten no pão e no strogonoff. Contém lactose no strogonoff. Pode conter ovo, leite e derivados no molho para salada ""Bom Sabor""."
2023-07-19,ARROZ E FEIJÃO,Linguiça toscana acebolada,Abobrinha refogada,Escarola,Laranja,Uva,PÃO E CAFÉ,"Contém glúten no pão. Pode conter ovo, leite e derivados no molho para salada ""Bom Sabor""."
2023-07-20,ARROZ E FEIJÃO,Lagarto com alho poró,Couve refogada,Pepino,Curau com canela,Pêssego,PÃO E CAFÉ,"Contém glúten no pão, no lagarto com alho poró e no curau. Contém lactose no curau. Pode conter ovo, leite e derivados no molho para salada ""Bom Sabor""."
2023-07-21,ARROZ E FEIJÃO,Sobrecoxa ao molho de azeitona,Polenta cremosa,Cenoura ralada,Maçã,Maracujá,PÃO E CAFÉ,"Contém glúten no pão e no prato principal. Pode conter ovo, leite e derivados no molho para salada ""Bom Sabor""."
2023-07-24,ARROZ E FEIJÃO,Quibe assado com limão,Purê de batatas,Caponata de beringela,Laranja,Laranja,PÃO E CAFÉ,"Contém glúten no pão, no quibe e no molho. Contém lactose no purê. Pode conter ovos no purê."
2023-07-25,ARROZ E FEIJÃO,Carne moída nutritiva (batata doce e cenoura),Acelga refogada,Alface crespa,Maçã,Manga,PÃO E CAFÉ,Contém glúten no pão e na carne moída. Não contém ovos e lactose.
2023-07-26,ARROZ E FEIJÃO,Peixe ao molho de hortelã,"Legumes refogados (cenoura, batata e couve-flor)",Almeirão,Sagu de uva,Morango,PÃO E CAFÉ,Contém glúten no pão e no peixe ao molho de hortelã. Pode conter ovos no peixe ao molho de hortelã. Não contém lactose.
2023-07-27,ARROZ E FEIJÃO,Bife ao molho de mostarda,Purê de batata,Repolho bicolor,Banana,Goiaba,PÃO E CAFÉ,Contém glúten no pão e no prato principal. Não contém ovos e lactose.
2023-07-28,ARROZ E FEIJÃO,Sobrecoxa ao molho de gengibre,Chuchu sautê,Escarola,Goiabada,Caju,PÃO E CAFÉ,Contém glúten no pão. Pode conter glúten e ovos no molho de gengibre. Não contém lactose.
2023-07-31,ARROZ E FEIJÃO,Bife acebolado / Quibe assado,"Legumes no vapor (chuchu, batata e cenoura)",Escarola com beterraba ralada,Gelatina de Morango,Maracujá,PÃO E CAFÉ,"Contém glúten no pão, na gelatina e no quibe assado. Contém lactose na gelatina. Não contém ovos."
2023-08-01,ARROZ E FEIJÃO,Sassami ao molho Roty,Acelga Refogada com passas,Alface,Maçã,Limão,PÃO E CAFÉ,Contém glúten no pão e no Sassami ao molho roty. Pode conter ovos no sassami ao molho roty. Não contém lactose.
2023-08-02,ARROZ E FEIJÃO,Paleta suína em cubos ao molho de azeitona/ quibe,Purê de Batatas,Escarola,Canjica,Morango,PÃO E CAFÉ,Contém glúten no pão e no prato principal. Pode conter ovos. Contém lactose no purê de batatas.
2023-08-03,ARROZ E FEIJÃO,Peixe à escabeche (pescada),Cenoura refogada,Almeirão com cebola,Doce de goiabada,Manga,PÃO E CAFÉ,Contém glúten no pão. Não contém ovos e lactose.
2023-08-04,ARROZ E FEIJÃO,Sobrecoxa ao molho de quiabo,Polenta cremosa,Acelga com rabanete ralado,Pudim de chocolate,Abacaxi,PÃO E CAFÉ,"Contém glúten no pão, no prato principal e no pudim de chocolate. Contém lactose no pudim de chocolate. Pode conter ovos no pudim de chocolate."
